2022091808,2882,2,short,SHOTGUN,3x1,right,8,83,Zone,3-4 Defense,73.0,Cover-6 Right,"SLANT, FLAT, HITCH, SLANT, CORNER",I,Short Right Pass,4
2022092513,3031,2,deep,EMPTY,3x2,right,10,69,Zone,3-4 Defense,41.0,Cover-3,"GO, SCREEN, GO, GO",I,Spread Deep Attack from Empty 3x2 Alignment,4
2022092513,3278,2,short,EMPTY,3x2,left,8,49,Man,3-4 Defense,61.0,Cover-1,"OUT, GO, IN, HITCH, GO",C,Short Left Pass,4
2022092513,3687,2,short,SHOTGUN,3x1,left,3,42,Zone,3-4 Defense,68.0,Cover-3,"FLAT, FLAT, FLAT, SCREEN, SLANT",I,Short Left Pass,4
2022092513,3925,2,short,SHOTGUN,2x2,middle,22,13,Zone,Heavy DE Front,97.0,Cover-3 Seam,"CROSS, ANGLE, HITCH, IN, CROSS",C,Short Middle Pass,4
2022100300,3073,2,short,SHOTGUN,2x2,middle,17,48,Zone,3-4 Defense,62.0,Cover-2,"SCREEN, ANGLE, POST, GO, GO",C,Short Middle Pass,4
2022100300,3150,2,short,EMPTY,3x2,right,11,80,Zone,3-4 Defense,30.0,Cover-3,"HITCH, SCREEN, GO, SLANT, HITCH",I,Short Right Pass,4
2022100910,3080,2,short,SHOTGUN,2x2,left,10,75,Man,Interior DL Heavy,35.0,Cover-1,"GO, GO, SCREEN, GO, SLANT",I,Short Left Pass,4
2022101600,2689,2,deep,SINGLEBACK,3x1,left,10,57,Zone,5-2 Defense,53.0,Cover-3,"CROSS, CORNER, FLAT, CROSS",IN,Spread Misdirection Play,4
2022101600,2984,2,short,SHOTGUN,2x2,left,4,28,Zone,Interior DL Heavy,82.0,Cover-3,"GO, GO, GO, GO, SCREEN",C,Short Left Pass,4
2022101600,3097,2,short,SHOTGUN,3x1,left,14,29,Zone,5-2 Defense,81.0,Cover-3,"GO, HITCH, FLAT, HITCH, POST",C,Short Left Pass,4
2022101600,3238,2,short,SHOTGUN,3x1,middle,14,64,Zone,5-2 Defense,46.0,Cover-3,"HITCH, HITCH, HITCH, GO",C,Short Middle Pass,4
2022101600,3552,2,short,SHOTGUN,2x2,left,5,34,Zone,5-2 Defense,76.0,Cover-3,"FLAT, CROSS, POST, HITCH, POST",C,Short Left Pass,4
2022102310,3379,2,short,SHOTGUN,3x1,right,10,25,Man,Interior DL Heavy,15.0,Cover-0,"CROSS, WHEEL, SLANT, OUT, OUT",I,Short Right Pass,4
2022102310,3990,2,short,SHOTGUN,2x2,right,1,76,Man,5-2 Defense,66.0,2-Man,"FLAT, SLANT, SLANT, SLANT, HITCH",I,Short Right Pass,4
2022102310,4097,2,short,SHOTGUN,3x1,right,12,75,Zone,5-2 Defense,65.0,Cover-2,"OUT, GO, POST, GO",C,Short Right Pass,4
2022102310,4500,2,short,EMPTY,3x2,middle,10,43,Man,5-2 Defense,33.0,2-Man,"POST, IN, CROSS, FLAT, IN",C,Short Middle Pass,4
2022103010,2636,2,short,EMPTY,3x2,right,5,79,Zone,5-2 Defense,31.0,Quarters,"SCREEN, FLAT, SLANT, GO, FLAT",C,Short Right Pass,4
2022103010,2955,2,deep,SHOTGUN,2x2,left,7,40,Zone,3-4 Defense,70.0,Quarters,"IN, ANGLE, FLAT, GO, HITCH",C,Midfield Deep Shotgun Attack,4
2022091102,3336,3,short,SHOTGUN,3x1,middle,10,35,Zone,5-2 Defense,75.0,Cover-2,"HITCH, GO, OUT, HITCH",C,Short Middle Pass,4
2022091102,3402,3,short,SHOTGUN,3x1,middle,5,51,Man,3-4 Defense,59.0,Cover-1,"FLAT, CROSS, HITCH, IN, SLANT",IN,Short Middle Pass,4
2022091102,3899,3,short,SHOTGUN,2x2,middle,8,56,Zone,3-4 Defense,54.0,Cover-2,"CROSS, GO, IN, ANGLE, GO",I,Short Middle Pass,4
2022091808,2991,3,short,EMPTY,3x2,left,7,62,Zone,Heavy DE Front,52.0,Cover-6 Right,"GO, IN, POST, IN, OUT",I,Short Left Pass,4
2022091808,3311,3,short,SHOTGUN,2x2,left,9,61,Zone,Heavy DE Front,51.0,Cover-3,"FLAT, ANGLE, IN, POST, GO",C,Short Left Pass,4
2022092513,3070,3,short,SHOTGUN,2x1,left,10,69,Man,Heavy DE Front,41.0,Cover-1,"FLAT, HITCH, GO, IN",C,Short Left Pass,4
2022092513,3302,3,short,SHOTGUN,2x1,middle,3,54,Man,Heavy DE Front,56.0,Cover-1,"POST, ANGLE, GO, HITCH",I,Short Middle Pass,4
2022092513,3709,3,short,EMPTY,3x2,left,3,42,Man,3-4 Defense,68.0,Cover-1,"CORNER, IN, IN, HITCH, OUT",C,Short Left Pass,4
2022100300,2759,3,short,SHOTGUN,2x2,right,1,109,Other,3-4 Defense,1.0,Red Zone,"CROSS, IN, OUT, CROSS",I,Short Right Pass,4
2022100300,3097,3,short,SHOTGUN,3x1,left,13,52,Zone,3-4 Defense,58.0,Cover-3,"FLAT, FLAT, SCREEN, GO, SLANT",C,Short Left Pass,4
2022100300,3172,3,short,SHOTGUN,3x1,left,11,80,Zone,3-4 Defense,30.0,Cover-3,"FLAT, FLAT, GO, SCREEN, FLAT",C,Short Left Pass,4
2022100910,3102,3,short,SHOTGUN,3x1,left,10,75,Man,Interior DL Heavy,35.0,Cover-1,"OUT, GO, HITCH, OUT",C,Short Left Pass,4
2022101600,3164,3,short,SHOTGUN,3x1,right,12,54,Man,Interior DL Heavy,56.0,Cover-1,"FLAT, HITCH, SLANT, IN, OUT",C,Short Right Pass,4
2022102310,3406,3,short,SHOTGUN,2x2,middle,10,25,Man,5-2 Defense,15.0,2-Man,"POST, SLANT, GO, OUT",C,Short Middle Pass,4
2022102310,4121,3,short,SHOTGUN,2x2,left,3,66,Zone,5-2 Defense,56.0,Cover-2,"OUT, GO, SLANT, GO, HITCH",C,Short Left Pass,4
2022102310,4371,3,short,SHOTGUN,2x2,left,9,74,Zone,5-2 Defense,64.0,Cover-2,"HITCH, SLANT, IN, SLANT, FLAT",C,Short Left Pass,4
2022102310,4443,3,deep,SHOTGUN,3x1,right,10,65,Zone,5-2 Defense,55.0,Cover-2,"IN, GO, HITCH, OUT, POST",C,Third-and-Long Deep Attack,4
2022103010,3021,3,short,SINGLEBACK,2x2,left,3,103,Other,LB Heavy Defense,7.0,Red Zone,"SLANT, FLAT, CROSS, CROSS",C,Short Yardage Pass,4
2022091102,3921,4,short,SHOTGUN,2x1,right,8,56,Zone,5-2 Defense,54.0,Cover-2,"FLAT, FLAT, HITCH, HITCH, IN",I,Short Right Pass,4
2022091102,4166,4,deep,SHOTGUN,3x1,middle,9,31,Zone,5-2 Defense,79.0,Cover-2,"GO, IN, POST, HITCH",I,Midfield Deep Shotgun Attack,4
2022101600,3339,4,short,SHOTGUN,3x1,middle,2,91,Zone,5-2 Defense,19.0,Cover-2,"OUT, GO, ANGLE, SLANT, SLANT",I,Short Middle Pass,4
