2022103000,2834,2,short,SINGLEBACK,2x2,right,7,55,Zone,3-4 Defense,55.0,Cover-3,"SCREEN, GO, GO, CROSS",C,Singleback Balanced Short Pass,3
2022103000,3042,2,short,SHOTGUN,3x1,left,15,44,Zone,3-4 Defense,66.0,Cover-3,"CROSS, OUT, GO, OUT, SCREEN",C,Short Left Pass,3
2022110604,2030,2,short,EMPTY,3x2,left,5,50,Man,5-2 Defense,40.0,Cover-1,"IN, CROSS, IN, OUT, HITCH",C,Short Left Pass,3
2022110604,2242,2,short,SHOTGUN,3x1,right,7,17,Man,5-2 Defense,7.0,Cover-0,"HITCH, CROSS, CORNER",C,Short Right Pass,3
2022110604,2490,2,short,SHOTGUN,2x2,right,7,74,Zone,5-2 Defense,64.0,Cover-3,"GO, SCREEN, FLAT, POST, FLAT",C,Short Right Pass,3
2022110604,2559,2,deep,SHOTGUN,2x2,left,8,56,Zone,5-2 Defense,46.0,Cover-3,"POST, CROSS, CROSS, GO, ANGLE",C,Spread Misdirection Play,3
2022091109,2824,3,short,SHOTGUN,3x1,left,9,77,Zone,5-2 Defense,67.0,Cover-3 Cloud Left,"OUT, HITCH, HITCH, HITCH",C,Short Left Pass,3
2022091109,2991,3,short,SHOTGUN,3x1,middle,6,35,Zone,5-2 Defense,25.0,Cover-6 Right,"IN, CROSS, CORNER, SLANT, FLAT",I,Short Middle Pass,3
2022091803,1816,3,short,SHOTGUN,3x1,right,6,81,Zone,4-2-5 Nickel,71.0,Quarters,"SLANT, OUT, POST, IN, FLAT",C,Short Right Pass,3
2022091803,1935,3,short,SHOTGUN,3x1,right,8,56,Other,4-2-5 Nickel,46.0,Bracket,"HITCH, HITCH, HITCH, HITCH, FLAT",I,Short Right Pass,3
2022100903,2153,3,short,SHOTGUN,3x1,left,4,87,Zone,5-2 Defense,23.0,Cover-2,"GO, SCREEN, FLAT, FLAT",C,Short Left Pass,3
2022100903,2557,3,deep,EMPTY,3x2,middle,8,21,Zone,5-2 Defense,89.0,Cover-3,"POST, FLAT, HITCH, POST, HITCH",C,Third-and-Long Deep Attack,3
2022101603,3000,3,short,SHOTGUN,2x2,right,1,78,Man,Big Nickel,32.0,Cover-1,"HITCH, HITCH, SLANT, OUT, FLAT",I,Short Right Pass,3
2022102304,2833,3,deep,SHOTGUN,2x2,left,4,100,Zone,4-2-5 Nickel,90.0,Cover-2,"CORNER, CROSS, OUT",I,Hi-Lo Route Concept,3
2022103000,2858,3,short,SHOTGUN,3x1,right,8,54,Zone,3-4 Defense,56.0,Cover-3,"HITCH, OUT, IN, FLAT",I,Short Right Pass,3
2022110604,2514,3,short,SHOTGUN,3x1,right,2,69,Zone,5-2 Defense,59.0,Cover-2,"HITCH, CORNER, CROSS, HITCH, FLAT",C,Short Right Pass,3
2022110604,2625,3,short,SHOTGUN,3x1,middle,4,31,Zone,5-2 Defense,21.0,Cover-3,"IN, CORNER, HITCH, IN",C,Short Middle Pass,3
2022091803,2437,4,short,SINGLEBACK,3x1,right,1,15,Other,Big Nickel,5.0,Red Zone,"CROSS, POST, CROSS, FLAT",C,Short Yardage Pass,3
2022091109,3253,1,short,I_FORM,2x1,middle,10,79,Zone,5-2 Defense,31.0,Cover-3,"IN, OUT, CROSS, FLAT",I,Short Middle Pass,4
2022091109,4286,1,short,SHOTGUN,3x1,right,10,35,Zone,5-2 Defense,75.0,Cover-3,"HITCH, HITCH, HITCH, HITCH",C,Short Right Pass,4
2022091109,4387,1,short,SHOTGUN,2x2,left,15,50,Zone,5-2 Defense,60.0,Cover-3 Seam,"IN, HITCH, CROSS, GO, FLAT",I,Short Left Pass,4
2022092509,3250,1,short,SHOTGUN,3x1,right,10,42,Zone,5-2 Defense,68.0,Quarters,"SCREEN, FLAT, ANGLE, SCREEN",C,Short Right Pass,4
2022100209,3000,1,short,SHOTGUN,3x1,middle,10,41,Zone,5-2 Defense,69.0,Quarters,"GO, SCREEN, SCREEN, OUT, FLAT",C,Short Middle Pass,4
2022100209,3368,1,short,SHOTGUN,2x2,right,8,102,Man,5-2 Defense,8.0,Cover-1,"GO, FLAT, OUT, ANGLE, FLAT",C,Short Right Pass,4
2022100903,2688,1,deep,SINGLEBACK,2x2,left,10,57,Zone,4-2-5 Nickel,47.0,Cover-2,"GO, GO, FLAT",I,First Down Play Action Deep Pass,4
2022100903,2860,1,short,EMPTY,3x2,middle,10,90,Zone,5-2 Defense,80.0,Cover-2,"CORNER, HITCH, POST, SLANT, FLAT",I,Short Middle Pass,4
2022100903,3486,1,short,SHOTGUN,2x2,left,10,82,Zone,5-2 Defense,72.0,Cover-2,"CORNER, CROSS, POST, GO, ANGLE",C,Short Left Pass,4
2022100903,3741,1,deep,SHOTGUN,3x1,middle,10,97,Zone,5-2 Defense,87.0,Cover-2,"GO, IN, POST, GO, ANGLE",I,Shotgun Isolation Deep Attack,4
2022100903,3870,1,short,SHOTGUN,2x2,right,10,75,Other,5-2 Defense,65.0,Prevent,"GO, OUT, CORNER, GO, FLAT",C,Short Right Pass,4
2022100903,3895,1,deep,SHOTGUN,3x1,middle,10,63,Other,5-2 Defense,53.0,Prevent,"POST, GO, GO, GO, FLAT",IN,Shotgun Isolation Deep Attack,4
2022101603,3511,1,short,SHOTGUN,2x2,right,10,74,Zone,Big Nickel,64.0,Quarters,"FLAT, SLANT, OUT, ANGLE, GO",C,Short Right Pass,4
2022101603,3577,1,short,SHOTGUN,3x1,left,10,61,Zone,Big Nickel,51.0,Cover-3,"SCREEN, FLAT, FLAT, FLAT, GO",C,Short Left Pass,4
2022101603,3793,1,short,SHOTGUN,3x1,right,4,14,Other,Big Nickel,4.0,Red Zone,"OUT, FLAT, GO, CORNER, ANGLE",C,Short Right Pass,4
2022101603,4190,1,short,SHOTGUN,3x1,left,10,85,Zone,Big Nickel,75.0,Cover-2,"OUT, HITCH, CROSS, IN",C,Short Left Pass,4
2022101603,4214,1,short,SHOTGUN,3x1,right,10,69,Other,4-2-5 Nickel,59.0,Prevent,"GO, SLANT, GO, HITCH, SCREEN",C,Short Right Pass,4
2022102304,3258,1,deep,SHOTGUN,3x1,right,10,69,Man,4-3 Defense,41.0,Cover-1,"GO, GO, IN, FLAT",I,Shotgun Isolation Deep Attack,4
2022102304,3769,1,deep,SHOTGUN,3x1,middle,15,30,Man,4-3 Defense,80.0,Cover-1,"GO, CROSS, HITCH, CORNER",I,Scoring Zone Deep Pass,4
2022102304,4131,1,short,SHOTGUN,2x2,right,10,35,Man,3-1-7 Quarter,75.0,2-Man,"GO, HITCH, GO, GO, FLAT",I,Short Right Pass,4
2022102304,4298,1,short,SHOTGUN,2x2,left,10,55,Man,3-1-7 Quarter,55.0,2-Man,"GO, CROSS, OUT",I,Short Left Pass,4
2022102304,4455,1,deep,EMPTY,3x2,right,10,93,Zone,Secondary Emphasis with DT,17.0,Cover-6 Right,"GO, GO, GO, GO, POST",I,Spread Deep Attack from Empty 3x2 Alignment,4
2022103000,3317,1,short,SINGLEBACK,2x2,left,10,66,Zone,3-4 Defense,56.0,Cover-3,"CROSS, GO, FLAT",I,Singleback Balanced Short Pass,4
2022103000,3569,1,short,SHOTGUN,2x2,middle,10,57,Man,3-4 Defense,47.0,Cover-1,"HITCH, IN, OUT, IN, FLAT",C,Short Middle Pass,4
2022103000,3949,1,short,SHOTGUN,3x1,right,10,85,Zone,3-4 Defense,75.0,Cover-3,"GO, HITCH, CROSS, OUT, FLAT",IN,Short Right Pass,4
2022110604,3340,1,short,EMPTY,3x2,right,10,44,Zone,5-2 Defense,66.0,Cover-3,"SCREEN, SCREEN, GO, CROSS",C,Short Right Pass,4
2022091109,3229,2,short,SHOTGUN,2x2,right,8,67,Zone,5-2 Defense,43.0,Cover-6 Right,"HITCH, FLAT, POST, CROSS, FLAT",C,Short Right Pass,4
2022091109,3357,2,short,EMPTY,3x2,middle,22,67,Zone,5-2 Defense,43.0,Cover-3,"HITCH, CROSS, GO, HITCH, HITCH",C,Short Middle Pass,4
2022091109,3773,2,short,SHOTGUN,3x1,right,7,65,Zone,5-2 Defense,45.0,Quarters,"OUT, GO, OUT, FLAT",C,Short Right Pass,4
2022091109,4409,2,short,SHOTGUN,3x1,left,15,50,Zone,5-2 Defense,60.0,Cover-3,"HITCH, HITCH, HITCH, FLAT, FLAT",C,Short Left Pass,4
2022091803,2874,2,short,EMPTY,3x2,middle,11,22,Zone,Big Nickel,88.0,Quarters,"HITCH, HITCH, HITCH, GO, HITCH",C,Short Middle Pass,4
2022092509,3337,2,short,SHOTGUN,2x2,right,10,52,Man,5-2 Defense,58.0,Cover-1,"OUT, OUT, OUT, OUT",C,Short Right Pass,4
2022092509,3406,2,short,EMPTY,3x2,left,14,60,Zone,5-2 Defense,50.0,Cover-3 Seam,"SLANT, FLAT, SCREEN, GO, GO",C,Short Left Pass,4
2022100209,3276,2,short,SHOTGUN,2x2,middle,10,42,Man,Heavy LB Defense,68.0,Cover-1,"HITCH, GO, HITCH, POST, FLAT",C,Short Middle Pass,4
2022100209,3322,2,deep,EMPTY,3x2,left,10,57,Zone,5-2 Defense,53.0,Cover-6 Right,"OUT, GO, GO, OUT, GO",I,Spread Deep Attack from Empty 3x2 Alignment,4
2022100903,2710,2,short,EMPTY,3x2,right,10,57,Zone,4-2-5 Nickel,47.0,Cover-2,"GO, FLAT, SCREEN, SLANT, GO",C,Short Right Pass,4
2022100903,2882,2,short,EMPTY,3x2,left,10,90,Zone,5-2 Defense,80.0,Quarters,"HITCH, POST, GO, CROSS, GO",I,Short Left Pass,4
2022100903,3440,2,short,SHOTGUN,3x1,middle,2,88,Zone,5-2 Defense,78.0,Cover-2,"HITCH, HITCH, HITCH, HITCH, FLAT",I,Short Middle Pass,4
2022100903,3515,2,deep,SHOTGUN,3x1,right,5,77,Zone,5-2 Defense,67.0,Quarters,"IN, CROSS, GO, IN, FLAT",C,Shotgun Isolation Deep Attack,4
2022100903,3573,2,deep,SHOTGUN,2x2,right,10,60,Zone,5-2 Defense,50.0,Cover-2,"IN, CORNER, POST, IN, FLAT",I,Flood Concept (Intermediate Stretch),4
2022100903,3763,2,short,SHOTGUN,3x1,right,10,97,Zone,5-2 Defense,87.0,Cover-2,"HITCH, GO, GO, CROSS, FLAT",C,Short Right Pass,4
2022100903,3808,2,deep,SHOTGUN,3x1,right,10,86,Zone,5-2 Defense,76.0,Cover-2,"CORNER, IN, POST, GO, ANGLE",I,Shotgun Isolation Deep Attack,4
2022101603,3458,2,short,SHOTGUN,3x1,right,12,91,Zone,Big Nickel,81.0,Cover-3,"GO, SCREEN, CROSS, FLAT",C,Short Right Pass,4
2022102304,3280,2,short,SHOTGUN,3x1,left,10,69,Zone,4-3 Defense,41.0,Cover-3,"FLAT, CROSS, FLAT, GO",I,Short Left Pass,4
2022102304,3791,2,short,SHOTGUN,2x2,right,15,30,Zone,4-3 Defense,80.0,Cover-3 Seam,"HITCH, GO, HITCH, GO",C,Short Right Pass,4
2022102304,4153,2,short,SHOTGUN,3x1,left,10,35,Man,3-1-7 Quarter,75.0,2-Man,"GO, POST, CROSS, CROSS",I,Short Left Pass,4
2022102304,4477,2,deep,EMPTY,3x2,left,10,93,Other,Secondary Emphasis with DT,17.0,Prevent,"GO, GO, GO, GO, POST",I,Spread Deep Attack from Empty 3x2 Alignment,4
2022103000,3293,2,short,SHOTGUN,2x2,middle,12,83,Zone,3-4 Defense,73.0,Quarters,"HITCH, HITCH, POST, OUT, FLAT",C,Short Middle Pass,4
2022103000,3402,2,deep,SHOTGUN,2x2,middle,8,52,Zone,3-4 Defense,42.0,Cover-3 Seam,"CROSS, OUT, OUT, IN, FLAT",I,Deep Middle Pass,4
2022110604,3047,2,short,SHOTGUN,3x1,left,11,18,Zone,5-2 Defense,92.0,Cover-3,"OUT, FLAT, OUT, IN",C,Short Left Pass,4
2022110604,3103,2,short,SHOTGUN,3x1,middle,10,33,Zone,5-2 Defense,77.0,Cover-2,"HITCH, OUT, HITCH, CORNER, SCREEN",C,Short Middle Pass,4
2022110604,3364,2,short,SHOTGUN,3x1,right,9,45,Zone,5-2 Defense,65.0,Cover-2,"IN, FLAT, GO, HITCH, FLAT",C,Short Right Pass,4
2022091109,3381,3,short,SHOTGUN,3x1,middle,5,84,Zone,5-2 Defense,26.0,Cover-2,"GO, POST, CROSS, IN, ANGLE",I,Short Middle Pass,4
2022091109,4443,3,deep,SHOTGUN,3x1,left,11,54,Zone,Heavy DE Front,56.0,Cover-3,"GO, HITCH, FLAT, POST, FLAT",IN,Third-and-Long Deep Attack,4
2022091803,2898,3,short,SHOTGUN,2x2,right,6,27,Zone,Big Nickel,83.0,Cover-3,"GO, HITCH, GO, CROSS, FLAT",C,Short Right Pass,4
2022091803,3146,3,short,SHOTGUN,2x2,right,8,21,Zone,Big Nickel,89.0,Cover-3,"HITCH, FLAT, HITCH, HITCH, FLAT",I,Short Right Pass,4
2022092509,3361,3,short,SHOTGUN,3x1,middle,6,56,Zone,5-2 Defense,54.0,Cover-3,"HITCH, CROSS, CROSS, HITCH, FLAT",C,Short Middle Pass,4
2022092509,3430,3,short,SHOTGUN,3x1,right,6,68,Zone,5-2 Defense,42.0,Cover-3,"CROSS, GO, CROSS, CROSS, SCREEN",C,Short Right Pass,4
2022092509,3541,3,short,SHOTGUN,3x1,left,11,99,Zone,5-2 Defense,11.0,Cover-3,"CORNER, POST, CROSS, CROSS, FLAT",C,Short Left Pass,4
2022100209,3344,3,deep,EMPTY,3x2,middle,10,57,Zone,5-2 Defense,53.0,Quarters,"HITCH, IN, GO, HITCH, HITCH",C,Third-and-Long Deep Attack,4
2022100903,2734,3,short,SHOTGUN,2x2,left,7,54,Zone,5-2 Defense,44.0,Cover-2,"HITCH, HITCH, POST, IN, FLAT",C,Short Left Pass,4
2022100903,2927,3,short,SHOTGUN,3x1,right,15,95,Zone,5-2 Defense,85.0,Cover-2,"HITCH, GO, CROSS, FLAT, SCREEN",I,Short Right Pass,4
2022100903,3462,3,short,SHOTGUN,3x1,right,2,88,Zone,5-2 Defense,78.0,Cover-2,"OUT, IN, OUT, GO, OUT",C,Short Right Pass,4
2022100903,3595,3,short,SHOTGUN,2x2,middle,10,60,Zone,5-2 Defense,50.0,Cover-2,"HITCH, HITCH, POST, HITCH, FLAT",I,Short Middle Pass,4
2022100903,3841,3,short,SHOTGUN,2x2,right,10,86,Zone,5-2 Defense,76.0,Cover-2,"GO, CORNER, CORNER, GO, FLAT",C,Short Right Pass,4
2022101603,3482,3,deep,EMPTY,3x2,right,13,92,Zone,Big Nickel,82.0,Cover-3,"HITCH, OUT, POST, FLAT, IN",C,Third-and-Long Deep Attack,4
2022102304,3234,3,deep,SHOTGUN,3x1,right,8,49,Zone,4-2-5 Nickel,61.0,Cover-3,"POST, SCREEN, CORNER, OUT, ANGLE",C,Third-and-Long Deep Attack,4
2022102304,3309,3,short,EMPTY,3x2,right,10,69,Man,3-1-7 Quarter,41.0,2-Man,"IN, OUT, HITCH, IN, IN",C,Short Right Pass,4
2022102304,3815,3,short,SHOTGUN,3x1,left,5,40,Man,4-2-5 Nickel,70.0,Cover-1,"OUT, OUT, CORNER, ANGLE",I,Short Left Pass,4
2022102304,4175,3,short,SHOTGUN,3x1,right,10,35,Man,3-1-7 Quarter,75.0,2-Man,"GO, CORNER, OUT",C,Short Right Pass,4
2022110604,3127,3,short,SHOTGUN,3x1,right,3,40,Man,5-2 Defense,70.0,Cover-1,"SLANT, CROSS, GO, FLAT, CROSS",I,Short Right Pass,4
2022110604,3388,3,short,SHOTGUN,3x1,left,4,50,Man,5-2 Defense,60.0,Cover-1,"SLANT, CROSS, SLANT, OUT",C,Short Left Pass,4
