2022092504,2213,3,short,SHOTGUN,3x1,left,8,82,Man,5-2 Defense,72.0,Cover-1,"GO, FLAT, HITCH, HITCH",I,Short Left Pass,3
2022092504,2660,3,short,SHOTGUN,3x1,right,12,48,Man,5-2 Defense,38.0,Cover-0,"GO, SCREEN, SCREEN, GO, GO",I,Short Right Pass,3
2022100200,2179,3,short,SHOTGUN,3x1,right,9,26,Zone,Big Nickel,84.0,Cover-3,"CROSS, HITCH, ANGLE, HITCH, GO",I,Short Right Pass,3
2022100200,2341,3,short,SHOTGUN,3x1,right,7,103,Other,Big Nickel,7.0,Red Zone,"CROSS, HITCH, OUT, CORNER, POST",C,Short Right Pass,3
2022100200,2824,3,short,SHOTGUN,2x2,middle,8,57,Zone,Big Nickel,53.0,Quarters,"OUT, GO, OUT, HITCH, HITCH",C,Short Middle Pass,3
2022100904,2402,3,short,EMPTY,3x2,right,1,49,Zone,5-2 Defense,39.0,Cover-2,"CORNER, CROSS, GO, IN, IN",C,Short Right Pass,3
2022100904,2469,3,short,SHOTGUN,3x1,left,10,43,Zone,5-2 Defense,33.0,Cover-2,"POST, FLAT, FLAT, GO, HITCH",I,Short Left Pass,3
2022101604,2298,3,short,EMPTY,3x2,right,22,55,Man,Heavy DE Front,45.0,2-Man,"GO, HITCH, HITCH, SCREEN, GO",I,Short Right Pass,3
2022101604,2465,3,short,SHOTGUN,3x1,left,7,66,Man,Heavy DE Front,56.0,Cover-1,"IN, FLAT, FLAT, CORNER, CORNER",C,Short Left Pass,3
2022103005,2706,3,deep,EMPTY,3x2,left,5,69,Man,Big Secondary and LB,59.0,Cover-1,"IN, IN, HITCH, CORNER, IN",C,Spread Deep Attack from Empty 3x2 Alignment,3
2022110607,2079,3,short,SHOTGUN,3x1,middle,6,81,Man,4-2-5 Nickel,71.0,2-Man,"HITCH, FLAT, IN, HITCH, IN",C,Short Middle Pass,3
2022110607,2484,3,short,SHOTGUN,3x1,right,13,75,Zone,4-2-5 Nickel,65.0,Cover-3,"IN, FLAT, HITCH, HITCH, GO",I,Short Right Pass,3
2022091112,2840,1,deep,SHOTGUN,2x2,middle,10,26,Zone,Heavy DE Front,84.0,Cover-6 Right,"POST, ANGLE, CROSS, GO, POST",C,Scoring Zone Deep Pass,4
2022091112,2864,1,short,I_FORM,2x1,middle,10,48,Zone,3-4 Defense,62.0,Cover-3,"HITCH, OUT, ANGLE, POST",I,Short Middle Pass,4
2022091901,3088,1,short,SHOTGUN,2x2,left,15,105,Zone,5-2 Defense,95.0,Cover-6 Right,"IN, FLAT, SLANT, CORNER, HITCH",I,Short Left Pass,4
2022091901,3173,1,deep,SHOTGUN,3x1,left,10,87,Zone,Heavy LB Defense,77.0,Quarters,"HITCH, HITCH, FLAT, HITCH, HITCH",I,Flood Concept (Intermediate Stretch),4
2022091901,3287,1,short,SHOTGUN,2x2,right,10,61,Man,5-2 Defense,51.0,Cover-0,"IN, GO, OUT, CROSS",I,Short Right Pass,4
2022091901,3444,1,short,EMPTY,3x2,middle,9,19,Man,Heavy LB Defense,9.0,Cover-0,"SLANT, GO, OUT, OUT, IN",I,Red Zone Quick Pass,4
2022091901,3759,1,deep,SHOTGUN,2x2,right,10,88,Zone,5-2 Defense,78.0,Cover 6-Left,"CORNER, FLAT, OUT, HITCH, IN",C,Flood Concept (Intermediate Stretch),4
2022091901,3788,1,short,SHOTGUN,3x1,left,10,69,Zone,5-2 Defense,59.0,Cover-3,"POST, FLAT, OUT, IN, CORNER",C,Short Left Pass,4
2022091901,3918,1,short,SHOTGUN,2x2,middle,10,35,Zone,5-2 Defense,25.0,Cover 6-Left,"IN, HITCH, FLAT, HITCH, HITCH",C,Short Middle Pass,4
2022091901,3942,1,short,SHOTGUN,2x2,right,10,20,Other,5-2 Defense,10.0,Red Zone,"OUT, IN, FLAT, GO, OUT",I,Short Right Pass,4
2022092504,3338,1,short,SINGLEBACK,2x2,right,10,53,Man,5-2 Defense,57.0,Cover-1,"GO, SCREEN, SCREEN, GO, GO",C,Singleback Balanced Short Pass,4
2022092504,3362,1,short,SINGLEBACK,2x2,right,10,64,Man,5-2 Defense,46.0,Cover-1,"OUT, CROSS, GO",C,Singleback Balanced Short Pass,4
2022092504,3497,1,short,SINGLEBACK,2x2,right,9,101,Man,5-2 Defense,9.0,Cover-1,"CROSS, CORNER, SCREEN, CROSS",C,Singleback Balanced Short Pass,4
2022092504,3827,1,short,SINGLEBACK,2x2,left,10,40,Zone,5-2 Defense,70.0,Cover-3,"HITCH, SCREEN, POST, CROSS",C,Midfield Short Pass,4
2022092504,3862,1,deep,SINGLEBACK,3x1,right,10,55,Man,5-2 Defense,55.0,2-Man,"CORNER, FLAT, ANGLE, IN, GO",I,First Down Play Action Deep Pass,4
2022092504,4122,1,short,SHOTGUN,2x2,middle,10,54,Man,5-2 Defense,56.0,Cover-1,"POST, IN, FLAT, CORNER, SLANT",I,Short Middle Pass,4
2022092504,4168,1,deep,SHOTGUN,3x1,right,10,82,Man,5-2 Defense,28.0,2-Man,"OUT, FLAT, OUT, CORNER",C,Flood Concept (Intermediate Stretch),4
2022100200,3327,1,short,SINGLEBACK,2x2,left,10,85,Zone,Big Nickel,75.0,Quarters,"CROSS, FLAT, POST, HITCH, OUT",I,Singleback Balanced Short Pass,4
2022100200,3477,1,short,SINGLEBACK,2x2,left,10,61,Zone,Big Nickel,51.0,Cover-3,"GO, FLAT, OUT",I,Singleback Balanced Short Pass,4
2022100200,3965,1,deep,SHOTGUN,2x2,left,10,78,Man,4-2-5 Nickel,68.0,Cover-1,"GO, HITCH, GO, OUT",C,Flood Concept (Intermediate Stretch),4
2022100904,2896,1,short,SHOTGUN,3x1,middle,20,47,Zone,3-4 Defense,63.0,Cover-2,"OUT, ANGLE, HITCH, GO, HITCH",C,Short Middle Pass,4
2022100904,3001,1,short,I_FORM,2x1,right,10,68,Zone,3-4 Defense,42.0,Cover-2,"CROSS, FLAT, SCREEN, CORNER",IN,I-Formation Screen Play,4
2022100904,3228,1,short,SHOTGUN,3x1,middle,15,30,Zone,3-4 Defense,80.0,Cover-2,"POST, CROSS, CROSS, GO",C,Short Middle Pass,4
2022100904,3484,1,short,SINGLEBACK,2x2,right,10,95,Zone,3-4 Defense,15.0,Cover 6-Left,"CROSS, FLAT, CORNER, CROSS",I,Singleback Balanced Short Pass,4
2022100904,3556,1,short,SINGLEBACK,3x1,right,2,108,Man,3-4 Defense,2.0,Cover-0,"CORNER, FLAT, CROSS",I,Short Right Pass,4
2022101604,3015,1,short,SINGLEBACK,2x2,right,8,102,Man,3-4 Defense,8.0,Cover-1 Double,"CORNER, FLAT, CROSS, CROSS",C,Singleback Balanced Short Pass,4
2022101604,3296,1,short,I_FORM,2x1,right,10,35,Zone,3-4 Defense,75.0,Cover-3,"CORNER, FLAT, POST",C,Short Right Pass,4
2022103005,3492,1,deep,SHOTGUN,2x2,right,10,35,Zone,Heavy DE Front,75.0,Cover-3,"GO, OUT, HITCH, HITCH",I,Midfield Deep Shotgun Attack,4
2022110607,3284,1,short,SINGLEBACK,3x1,middle,10,98,Other,4-2-5 Nickel,12.0,Red Zone,"SCREEN, GO, GO, POST, POST",I,Short Middle Pass,4
2022110607,3499,1,short,SHOTGUN,2x2,middle,10,70,Zone,Other,40.0,Cover-3,"GO, OUT, GO, HITCH, GO",I,Short Middle Pass,4
2022110607,3649,1,short,SHOTGUN,2x2,middle,6,104,Other,4-2-5 Nickel,6.0,Red Zone,"IN, FLAT, OUT, POST",I,Short Middle Pass,4
2022091112,2952,2,short,EMPTY,3x2,right,6,76,Zone,3-4 Defense,34.0,Cover-3 Seam,"HITCH, POST, HITCH, HITCH, HITCH",C,Short Right Pass,4
2022091112,3050,2,short,SINGLEBACK,3x1,left,10,100,Zone,3-4 Defense,10.0,Cover-3 Seam,"GO, SLANT, CROSS",I,Short Left Pass,4
2022091901,3110,2,short,EMPTY,3x2,right,15,105,Zone,5-2 Defense,95.0,Cover-3,"HITCH, HITCH, IN, HITCH, HITCH",C,Short Right Pass,4
2022091901,3195,2,short,SHOTGUN,2x2,right,10,87,Man,Heavy LB Defense,77.0,Cover-1,"GO, CROSS, OUT, IN, POST",C,Short Right Pass,4
2022091901,3241,2,short,SHOTGUN,3x1,right,10,72,Zone,5-2 Defense,62.0,Quarters,"HITCH, GO, OUT, OUT, IN",I,Short Right Pass,4
2022091901,3309,2,short,SHOTGUN,3x1,right,10,61,Man,5-2 Defense,51.0,Cover-0,"GO, FLAT, GO, HITCH, SLANT",I,Short Right Pass,4
2022091901,3466,2,short,EMPTY,3x2,left,9,19,Man,Heavy LB Defense,9.0,Cover-0,"CROSS, OUT, CROSS, OUT, HITCH",I,Red Zone Quick Pass,4
2022091901,3735,2,short,SHOTGUN,2x2,middle,3,92,Zone,5-2 Defense,82.0,Cover 6-Left,"OUT, ANGLE, OUT, OUT, HITCH",C,Short Middle Pass,4
2022091901,3812,2,short,SHOTGUN,2x2,right,4,63,Zone,Heavy LB Defense,53.0,Cover-2,"HITCH, GO, FLAT, HITCH, HITCH",C,Short Right Pass,4
2022091901,3894,2,short,SHOTGUN,2x2,right,7,42,Zone,5-2 Defense,32.0,Cover 6-Left,"GO, POST, ANGLE, POST, HITCH",C,Short Right Pass,4
2022091901,3976,2,short,EMPTY,3x2,left,10,20,Other,Heavy LB Defense,10.0,Red Zone,"HITCH, FLAT, SCREEN, CROSS, GO",C,Red Zone Quick Pass,4
2022092504,3473,2,short,SHOTGUN,2x2,right,5,89,Zone,5-2 Defense,21.0,Cover-2,"HITCH, FLAT, HITCH, HITCH",C,Short Right Pass,4
2022092504,3884,2,short,EMPTY,3x2,right,10,55,Man,5-2 Defense,55.0,Cover-0,"SCREEN, SCREEN, GO, FLAT",C,Short Right Pass,4
2022092504,4144,2,deep,SHOTGUN,3x1,left,10,54,Man,5-2 Defense,56.0,Cover-1,"GO, FLAT, FLAT, IN, CROSS",C,Shotgun Isolation Deep Attack,4
2022100200,3424,2,short,SHOTGUN,3x1,left,21,84,Zone,Big Nickel,74.0,Cover-3 Seam,"HITCH, HITCH, OUT, OUT, IN",C,Short Left Pass,4
2022100200,3579,2,short,SINGLEBACK,3x1,right,9,55,Zone,Big Nickel,45.0,Quarters,"OUT, FLAT, FLAT, CORNER, CROSS",C,Short Right Pass,4
2022100904,2920,2,short,SINGLEBACK,3x1,right,13,54,Zone,3-4 Defense,56.0,Cover-6 Right,"GO, SCREEN, GO, GO",C,Short Right Pass,4
2022100904,3273,2,short,SINGLEBACK,3x1,left,5,50,Zone,3-4 Defense,60.0,Cover-3,"OUT, SCREEN, FLAT, GO, GO",C,Midfield Short Pass,4
2022100904,3339,2,short,SHOTGUN,2x2,left,14,52,Zone,3-4 Defense,58.0,Cover 6-Left,"GO, HITCH, FLAT, HITCH",C,Short Left Pass,4
2022100904,3434,2,short,SHOTGUN,3x1,left,9,86,Zone,3-4 Defense,24.0,Cover 6-Left,"OUT, HITCH, ANGLE, GO, HITCH",C,Short Left Pass,4
2022101604,3044,2,short,SINGLEBACK,2x2,middle,2,108,Man,3-4 Defense,2.0,Cover-0,"IN, CROSS, CROSS, CROSS",C,Singleback Balanced Short Pass,4
2022101604,3320,2,short,SHOTGUN,2x2,middle,10,35,Zone,3-4 Defense,75.0,Cover-3,"HITCH, IN, OUT, GO",C,Short Middle Pass,4
2022103005,3514,2,short,SHOTGUN,3x1,left,10,35,Zone,Heavy DE Front,75.0,Cover-2,"FLAT, GO, SCREEN, GO",C,Short Left Pass,4
2022103005,3665,2,short,SHOTGUN,2x2,left,13,94,Zone,Heavy DE Front,16.0,Cover-2,"CORNER, OUT, FLAT, IN, IN",C,Short Left Pass,4
2022110607,2984,2,short,SHOTGUN,2x2,left,18,40,Zone,Other,70.0,Cover-6 Right,"OUT, FLAT, IN, OUT, GO",C,Short Left Pass,4
2022110607,3070,2,short,SHOTGUN,2x2,right,13,95,Zone,4-2-5 Nickel,15.0,Cover-2,"HITCH, FLAT, GO, OUT, GO",I,Short Right Pass,4
2022110607,3306,2,short,SHOTGUN,3x1,left,10,98,Other,4-2-5 Nickel,12.0,Red Zone,"WHEEL, IN, IN, CORNER, IN",C,Short Left Pass,4
2022110607,3475,2,short,SHOTGUN,2x2,middle,6,60,Zone,4-2-5 Nickel,50.0,Cover-3,"HITCH, FLAT, SLANT, GO, OUT",C,Short Middle Pass,4
2022110607,3596,2,short,I_FORM,2x1,right,3,96,Zone,4-2-5 Nickel,14.0,Cover-3,"FLAT, FLAT, CROSS, SLANT",C,Short Right Pass,4
2022091112,2907,3,deep,EMPTY,3x2,right,7,51,Zone,3-4 Defense,59.0,Cover-3 Seam,"POST, FLAT, FLAT, CROSS, CROSS",C,Third-and-Long Deep Attack,4
2022091112,3072,3,short,SHOTGUN,3x1,left,10,100,Other,3-4 Defense,10.0,Red Zone,"CROSS, HITCH, IN, OUT",I,Short Left Pass,4
2022091901,3139,3,short,SHOTGUN,3x1,left,9,99,Man,Interior DL Heavy,89.0,Cover-1 Double,"OUT, ANGLE, IN, CORNER",C,Short Left Pass,4
2022091901,3263,3,short,SHOTGUN,3x1,left,10,72,Zone,Interior DL Heavy,62.0,Cover-2,"HITCH, FLAT, FLAT, CORNER, HITCH",C,Short Left Pass,4
2022091901,3488,3,short,EMPTY,3x2,left,9,19,Man,Heavy LB Defense,9.0,Cover-0,"IN, HITCH, HITCH, GO, HITCH",IN,Red Zone Quick Pass,4
2022092504,3149,3,short,EMPTY,3x2,middle,19,27,Zone,5-2 Defense,83.0,Cover-3,"GO, GO, SLANT, OUT, POST",C,Short Middle Pass,4
2022092504,3908,3,deep,SHOTGUN,3x1,right,8,57,Man,5-2 Defense,53.0,Cover-1,"GO, CROSS, IN, CROSS",I,Third-and-Long Deep Attack,4
2022100200,3453,3,short,SHOTGUN,3x1,right,4,67,Man,Big Nickel,57.0,Cover-1,"CROSS, CROSS, FLAT, OUT, FLAT",C,Short Right Pass,4
2022100904,2944,3,short,SHOTGUN,3x1,left,11,56,Zone,5-2 Defense,54.0,Cover 6-Left,"HITCH, FLAT, HITCH, HITCH",C,Short Left Pass,4
2022100904,3368,3,short,SHOTGUN,3x1,middle,4,62,Zone,5-2 Defense,48.0,Cover-2,"GO, CROSS, FLAT, IN, HITCH",C,Short Middle Pass,4
2022100904,3532,3,short,SHOTGUN,3x1,left,8,97,Zone,3-4 Defense,13.0,Cover-2,"HITCH, CORNER, OUT, CROSS, IN",C,Short Left Pass,4
2022101604,3344,3,short,SHOTGUN,3x1,left,1,44,Man,3-4 Defense,66.0,Cover-0,"FLAT, FLAT, HITCH, GO, CROSS",I,Short Left Pass,4
2022103005,3570,3,short,SHOTGUN,3x1,right,10,35,Zone,Big Secondary and LB,75.0,Cover-2,"POST, FLAT, HITCH, HITCH",C,Short Right Pass,4
2022103005,3699,3,short,SHOTGUN,3x1,right,2,105,Man,Heavy DE Front,5.0,Cover-0,"IN, FLAT, SLANT, OUT",C,Short Right Pass,4
2022103005,4253,3,short,SHOTGUN,3x1,right,8,53,Zone,Big Secondary and LB,57.0,Cover-3,"GO, SCREEN, IN, GO, GO",C,Short Right Pass,4
2022110607,3019,3,deep,EMPTY,3x2,left,7,51,Man,4-2-5 Nickel,59.0,Cover-0,"IN, HITCH, CORNER, GO, HITCH",C,Third-and-Long Deep Attack,4
2022110607,3092,3,short,SHOTGUN,2x2,middle,13,95,Zone,4-2-5 Nickel,15.0,Cover 6-Left,"IN, FLAT, HITCH, OUT, OUT",C,Short Middle Pass,4
2022110607,3620,3,short,SHOTGUN,3x1,left,4,95,Man,Other,15.0,Cover-1,"IN, FLAT, FLAT, HITCH, GO",C,Short Left Pass,4
2022110607,3692,3,short,SHOTGUN,3x1,right,4,106,Other,4-2-5 Nickel,4.0,Red Zone,"IN, FLAT, HITCH, GO, HITCH",I,Short Right Pass,4
2022092504,3930,4,short,SHOTGUN,3x1,right,8,57,Man,5-2 Defense,53.0,Cover-1,"HITCH, IN, IN, CROSS",I,Short Right Pass,4
