2022100200,2553,4,short,SHOTGUN,3x1,middle,4,51,Zone,5-2 Defense,41.0,Cover-6 Right,"ANGLE, IN, FLAT, SLANT, IN",C,Short Middle Pass,3
2022091100,3119,1,deep,SHOTGUN,2x2,right,10,35,Zone,Interior DL Heavy,75.0,Cover-3,"ANGLE, POST, CORNER, POST, HITCH",C,Midfield Deep Shotgun Attack,4
2022091100,3148,1,short,SHOTGUN,2x2,middle,10,61,Zone,Interior DL Heavy,49.0,Cover-2,"GO, GO, ANGLE, GO, GO",C,Short Middle Pass,4
2022091100,3177,1,deep,SHOTGUN,2x2,left,10,76,Zone,Interior DL Heavy,34.0,Cover-3,"GO, GO, ANGLE, GO, GO",C,General Strategy,4
2022091100,3201,1,short,SHOTGUN,3x1,left,3,107,Man,5-2 Defense,3.0,Cover-0,"OUT, GO, CROSS, GO",C,Short Left Pass,4
2022091100,3446,1,deep,SHOTGUN,2x2,right,10,24,Zone,Interior DL Heavy,86.0,Cover-2,"SCREEN, ANGLE, OUT, CORNER, OUT",C,Scoring Zone Deep Pass,4
2022091100,3475,1,short,SHOTGUN,2x2,middle,10,44,Zone,Interior DL Heavy,66.0,Cover-3,"IN, FLAT, OUT, IN, GO",C,Short Middle Pass,4
2022091100,3554,1,short,SHOTGUN,2x2,right,10,72,Man,5-2 Defense,38.0,Cover-1,"GO, GO, SCREEN, GO, GO",C,Short Right Pass,4
2022091100,3647,1,deep,SHOTGUN,3x1,left,5,87,Zone,5-2 Defense,23.0,Quarters,"OUT, OUT, GO, CROSS, GO",C,Shotgun Isolation Deep Attack,4
2022091100,3671,1,short,SHOTGUN,3x1,left,9,101,Other,5-2 Defense,9.0,Red Zone,"ANGLE, POST, GO, POST, HITCH",C,Short Left Pass,4
2022091100,4032,1,deep,SHOTGUN,3x1,left,10,30,Man,5-2 Defense,80.0,2-Man,"GO, GO, SCREEN, POST",C,Scoring Zone Deep Pass,4
2022091804,3692,1,deep,SHOTGUN,2x2,right,10,57,Zone,Heavy DE Front,53.0,Quarters,"HITCH, POST, OUT, POST, GO",I,Flood Concept (Intermediate Stretch),4
2022091804,3742,1,short,SHOTGUN,3x1,left,10,68,Zone,Heavy DE Front,42.0,Cover-3,"HITCH, HITCH, ANGLE, POST, HITCH",IN,Short Left Pass,4
2022091804,3804,1,short,SHOTGUN,2x2,right,10,35,Zone,Heavy DE Front,75.0,Cover 6-Left,"CORNER, POST, HITCH, IN",I,Short Right Pass,4
2022091804,3887,1,short,SHOTGUN,3x1,left,10,87,Zone,Heavy DE Front,23.0,Quarters,"OUT, FLAT, HITCH, HITCH, IN",C,Short Left Pass,4
2022091804,3938,1,short,SHOTGUN,3x1,right,15,92,Zone,3-4 Defense,18.0,Quarters,"GO, GO, CROSS, OUT",C,Short Right Pass,4
2022091804,4190,1,deep,SHOTGUN,3x1,right,10,20,Zone,3-4 Defense,90.0,Cover-3,"CROSS, GO, OUT, HITCH, GO",C,Red Zone Deep Shotgun Attack,4
2022091804,4345,1,deep,SHOTGUN,3x1,right,10,33,Zone,3-4 Defense,77.0,Cover-2,"POST, CORNER, ANGLE, CROSS, GO",I,Midfield Deep Shotgun Attack,4
2022092500,2938,1,short,SHOTGUN,2x2,right,10,88,Zone,3-4 Defense,78.0,Cover-3,"OUT, ANGLE, HITCH, OUT, OUT",C,Short Right Pass,4
2022092500,2991,1,short,SHOTGUN,2x2,right,10,64,Zone,5-2 Defense,54.0,Quarters,"GO, FLAT, IN, OUT, GO",C,Short Right Pass,4
2022092500,3044,1,short,SHOTGUN,3x1,middle,10,44,Zone,Heavy LB Defense,34.0,Cover-3,"HITCH, ANGLE, GO, CROSS, HITCH",C,Short Middle Pass,4
2022092500,3243,1,short,SHOTGUN,3x1,right,10,85,Zone,Heavy LB Defense,75.0,Quarters,"OUT, IN, GO, CROSS, OUT",C,Short Right Pass,4
2022092500,3272,1,short,SHOTGUN,3x1,left,10,74,Zone,Heavy LB Defense,64.0,Cover-3,"SCREEN, HITCH, IN, HITCH, HITCH",I,Short Left Pass,4
2022092500,3490,1,short,SHOTGUN,2x2,right,10,85,Zone,Heavy LB Defense,75.0,Cover-3,"ANGLE, IN, GO, GO",I,Short Right Pass,4
2022092500,3838,1,deep,SHOTGUN,3x1,left,10,100,Zone,Heavy LB Defense,90.0,Cover-2,"ANGLE, POST, CORNER, CORNER",C,Flood Concept (Intermediate Stretch),4
2022092500,3862,1,deep,SHOTGUN,3x1,right,10,62,Zone,Heavy LB Defense,52.0,Cover-3,"FLAT, GO, GO, HITCH",C,Shotgun Isolation Deep Attack,4
2022092500,4056,1,deep,SHOTGUN,3x1,right,10,109,Zone,Heavy LB Defense,99.0,Cover 6-Left,"FLAT, POST, CORNER, OUT, GO",IN,Shotgun Isolation Deep Attack,4
2022100200,3073,1,short,SINGLEBACK,3x1,right,10,35,Zone,3-1-7 Quarter,75.0,Cover-2,"FLAT, CROSS, HITCH, HITCH",C,Midfield Short Pass,4
2022100200,3731,1,short,SHOTGUN,2x2,right,20,25,Zone,Interior DL Heavy,85.0,Cover-6 Right,"ANGLE, GO, GO, GO, HITCH",C,Short Right Pass,4
2022100200,4114,1,deep,SHOTGUN,3x1,middle,10,35,Zone,5-2 Defense,75.0,Cover-2,"GO, SCREEN, GO, POST",C,Midfield Deep Shotgun Attack,4
2022100200,4138,1,short,SHOTGUN,2x2,right,10,67,Zone,5-2 Defense,43.0,Cover-2,"HITCH, OUT, HITCH, OUT",I,Short Right Pass,4
2022100906,3675,1,short,SHOTGUN,2x2,right,10,43,Zone,3-4 Defense,67.0,Cover-3,"FLAT, SLANT, GO, GO, SLANT",C,Short Right Pass,4
2022101605,3186,1,short,WILDCAT,3x1,right,10,96,Man,3-4 Defense,14.0,Cover-0,"OUT, FLAT, CROSS, CORNER",I,Short Right Pass,4
2022101605,3923,1,short,SHOTGUN,2x2,right,10,52,Zone,4-2-5 Nickel,58.0,Cover 6-Left,"GO, FLAT, IN, GO, GO",C,Short Right Pass,4
2022101605,3982,1,short,SHOTGUN,2x2,middle,10,69,Zone,4-2-5 Nickel,41.0,Cover-3,"GO, ANGLE, GO, GO, GO",I,Short Middle Pass,4
2022102000,3095,1,short,SHOTGUN,2x2,left,10,56,Zone,Heavy DE Front,46.0,Cover 6-Left,"FLAT, GO, GO, GO, IN",C,Short Left Pass,4
2022102000,3124,1,short,SHOTGUN,2x2,left,10,45,Zone,Heavy DE Front,35.0,Cover-6 Right,"FLAT, CROSS, SLANT, GO, GO",C,Short Left Pass,4
2022102000,3172,1,short,SHOTGUN,3x1,middle,10,33,Zone,Heavy DE Front,23.0,Cover-3 Seam,"ANGLE, POST, GO, GO, HITCH",C,Short Middle Pass,4
2022102000,3536,1,short,SHOTGUN,3x1,right,10,85,Zone,Big Secondary and LB,75.0,Cover 6-Left,"FLAT, POST, FLAT, HITCH, HITCH",C,Short Right Pass,4
2022102000,3622,1,short,SHOTGUN,2x2,right,10,73,Zone,Big Secondary and LB,63.0,Cover-3 Cloud Right,"ANGLE, OUT, GO, HITCH, POST",C,Short Right Pass,4
2022102000,3651,1,short,SHOTGUN,2x2,right,10,56,Zone,Big Secondary and LB,46.0,Cover-3,"ANGLE, IN, HITCH, HITCH, HITCH",C,Short Right Pass,4
2022102000,3680,1,short,SHOTGUN,2x2,middle,10,43,Zone,3-1-7 Quarter,33.0,Cover-2,"ANGLE, GO, POST, GO, GO",C,Short Middle Pass,4
2022102000,3704,1,short,SHOTGUN,2x2,right,10,32,Zone,3-1-7 Quarter,22.0,Cover-2,"ANGLE, IN, FLAT, HITCH, SLANT",I,Short Right Pass,4
2022102000,3991,1,deep,SHOTGUN,2x2,middle,10,90,Man,Big Secondary and LB,80.0,2-Man,"POST, SLANT, GO, GO",C,Deep Middle Pass,4
2022102000,4015,1,short,SHOTGUN,3x1,right,10,70,Zone,Big Secondary and LB,60.0,Cover 6-Left,"IN, CROSS, HITCH, HITCH",C,Short Right Pass,4
2022102000,4094,1,short,SHOTGUN,2x2,middle,10,59,Zone,3-1-7 Quarter,49.0,Cover-2,"HITCH, OUT, HITCH, GO, GO",C,Short Middle Pass,4
2022102000,4142,1,short,SHOTGUN,2x2,right,10,40,Zone,3-1-7 Quarter,30.0,Cover-6 Right,"POST, POST, GO, HITCH",I,Short Right Pass,4
2022110700,3127,1,short,SHOTGUN,3x1,middle,10,35,Zone,Heavy DE Front,75.0,Cover 6-Left,"HITCH, GO, HITCH, HITCH",IN,Short Middle Pass,4
2022110700,3375,1,short,SHOTGUN,3x1,right,10,41,Zone,5-2 Defense,69.0,Cover 6-Left,"OUT, HITCH, HITCH, IN, CORNER",I,Short Right Pass,4
2022110700,3458,1,deep,SHOTGUN,2x2,left,10,69,Zone,5-2 Defense,41.0,Cover-3 Seam,"ANGLE, OUT, HITCH, OUT, OUT",I,Flood Concept (Intermediate Stretch),4
2022091100,3504,2,short,SHOTGUN,2x2,right,3,51,Zone,Interior DL Heavy,59.0,Cover-2,"HITCH, GO, HITCH, GO",I,Short Right Pass,4
2022091100,3578,2,deep,SHOTGUN,2x2,middle,20,62,Zone,5-2 Defense,48.0,Cover-3,"CORNER, IN, POST, HITCH",C,Deep Middle Pass,4
2022091100,4102,2,deep,SHOTGUN,3x1,middle,20,60,Man,5-2 Defense,50.0,Cover-1,"GO, GO, IN, GO",C,Shotgun Isolation Deep Attack,4
2022091804,3147,2,deep,SINGLEBACK,2x2,middle,8,57,Zone,3-1-7 Quarter,53.0,Cover-2,"POST, OUT, HITCH, POST",IN,Deep Middle Pass,4
2022091804,3495,2,deep,SHOTGUN,3x1,left,15,38,Zone,3-1-7 Quarter,72.0,Cover-3,"GO, HITCH, ANGLE, OUT, GO",IN,Midfield Deep Shotgun Attack,4
2022091804,3668,2,deep,SHOTGUN,2x2,right,15,35,Zone,3-4 Defense,75.0,Cover-3,"HITCH, GO, ANGLE, GO, HITCH",C,Midfield Deep Shotgun Attack,4
2022091804,3718,2,short,SHOTGUN,3x1,middle,10,57,Zone,Heavy DE Front,53.0,Quarters,"HITCH, POST, ANGLE, OUT, GO",C,Short Middle Pass,4
2022091804,3826,2,short,SHOTGUN,2x2,right,10,35,Zone,Heavy DE Front,75.0,Cover 6-Left,"CROSS, OUT, HITCH, IN, GO",C,Short Right Pass,4
2022091804,3971,2,short,SHOTGUN,3x1,middle,4,103,Other,3-4 Defense,7.0,Red Zone,"ANGLE, SLANT, HITCH, IN, CORNER",I,Short Middle Pass,4
2022092500,2967,2,short,SHOTGUN,2x2,right,2,80,Man,5-2 Defense,70.0,Cover-1,"CROSS, OUT, IN, GO, GO",C,Short Right Pass,4
2022092500,3020,2,short,SHOTGUN,2x2,left,1,55,Man,Heavy LB Defense,45.0,Cover-0,"HITCH, FLAT, SCREEN, SLANT, OUT",C,Short Left Pass,4
2022092500,3068,2,short,SHOTGUN,3x1,right,4,38,Zone,Heavy LB Defense,28.0,Cover-3,"IN, OUT, OUT, FLAT, GO",C,Short Right Pass,4
2022092500,3294,2,short,SHOTGUN,3x1,middle,10,74,Zone,Heavy LB Defense,64.0,Cover-3,"IN, OUT, CROSS, GO",IN,Short Middle Pass,4
2022092500,3547,2,short,SHOTGUN,2x2,middle,20,95,Zone,Heavy LB Defense,85.0,Quarters,"ANGLE, HITCH, GO, SLANT, HITCH",C,Short Middle Pass,4
2022100200,3181,2,deep,SINGLEBACK,2x2,right,8,71,Man,5-2 Defense,39.0,Cover-1,"OUT, CROSS, CROSS, GO",C,Hi-Lo Route Concept,4
2022100200,3231,2,short,SINGLEBACK,2x2,right,2,97,Zone,5-2 Defense,13.0,Cover-3 Seam,"FLAT, POST, FLAT, GO, POST",C,Singleback Balanced Short Pass,4
2022100200,3797,2,short,SHOTGUN,2x2,right,8,53,Zone,Interior DL Heavy,57.0,Cover-6 Right,"ANGLE, CROSS, CORNER, IN, POST",C,Short Right Pass,4
2022100200,3847,2,deep,SHOTGUN,3x1,left,9,68,Man,3-1-7 Quarter,42.0,Cover-1,"FLAT, IN, CROSS, HITCH, GO",I,Shotgun Isolation Deep Attack,4
2022100200,4173,2,short,SHOTGUN,2x2,right,10,67,Zone,5-2 Defense,43.0,Cover-2,"GO, OUT, CORNER, CORNER",I,Short Right Pass,4
2022100906,3773,2,deep,EMPTY,3x2,right,9,55,Man,3-4 Defense,55.0,Cover-1,"SCREEN, POST, POST, GO, GO",I,Spread Deep Attack from Empty 3x2 Alignment,4
2022100906,3863,2,short,SINGLEBACK,2x2,right,7,63,Zone,3-4 Defense,47.0,Cover-3,"FLAT, CORNER, CROSS, CROSS",C,Singleback Balanced Short Pass,4
2022101605,3088,2,short,WILDCAT,2x2,left,7,71,Zone,3-4 Defense,39.0,Quarters,"FLAT, GO, GO, IN, OUT",C,Short Left Pass,4
2022101605,3877,2,short,SHOTGUN,2x2,right,3,47,Zone,4-2-5 Nickel,63.0,Cover-6 Right,"FLAT, GO, IN, OUT, IN",I,Short Right Pass,4
2022101605,3947,2,short,SHOTGUN,2x2,right,2,60,Zone,4-2-5 Nickel,50.0,Cover-2,"POST, ANGLE, CROSS, OUT, IN",C,Short Right Pass,4
2022101605,4008,2,short,SHOTGUN,2x2,right,10,69,Man,4-2-5 Nickel,41.0,Cover-1,"OUT, OUT, IN, CORNER, CROSS",I,Short Right Pass,4
2022102000,3148,2,short,SHOTGUN,3x1,right,5,40,Zone,Heavy DE Front,30.0,Cover-3,"HITCH, HITCH, IN, CORNER",C,Short Right Pass,4
2022102000,3201,2,short,SHOTGUN,2x2,right,4,27,Man,3-4 Defense,17.0,Cover-0,"SLANT, FLAT, SLANT, SLANT",C,Short Right Pass,4
2022102000,3565,2,deep,SHOTGUN,2x2,right,3,78,Zone,Big Secondary and LB,68.0,Cover 6-Left,"IN, OUT, OUT, CORNER",I,Second-and-Short Deep Shot,4
2022102000,3726,2,short,SHOTGUN,3x1,left,10,32,Zone,Big Secondary and LB,22.0,Cover-3,"FLAT, OUT, FLAT, IN, POST",C,Short Left Pass,4
2022102000,3824,2,short,SHOTGUN,2x2,left,1,11,Man,Big Secondary and LB,1.0,Cover-0,"SLANT, GO, HITCH, GO",C,Short Left Pass,4
2022102000,4039,2,deep,SHOTGUN,3x1,right,5,65,Zone,Big Secondary and LB,55.0,Cover-6 Right,"FLAT, GO, CROSS, GO, GO",I,Shotgun Isolation Deep Attack,4
2022102000,4118,2,short,SHOTGUN,2x2,middle,3,52,Zone,3-1-7 Quarter,42.0,Cover-2,"GO, ANGLE, IN, GO, GO",C,Short Middle Pass,4
2022102000,4205,2,short,SHOTGUN,2x2,right,15,45,Man,Big Secondary and LB,35.0,2-Man,"CROSS, FLAT, POST, CORNER",I,Short Right Pass,4
2022103006,3030,2,short,PISTOL,3x1,right,5,98,Zone,4-3 Defense,88.0,Cover-3,"CROSS, HITCH, OUT",C,Pistol Quick Pass,4
2022110700,2843,2,short,SINGLEBACK,2x2,left,7,44,Man,5-2 Defense,66.0,Cover-1,"GO, FLAT, OUT",I,Midfield Short Pass,4
2022110700,3299,2,short,SHOTGUN,2x2,left,19,18,Zone,Heavy DE Front,92.0,Cover-3,"SLANT, FLAT, SLANT, GO",C,Short Left Pass,4
2022110700,3401,2,short,SHOTGUN,2x2,right,10,41,Zone,5-2 Defense,69.0,Cover 6-Left,"ANGLE, HITCH, HITCH, GO, HITCH",C,Short Right Pass,4
2022110700,3480,2,short,SHOTGUN,2x2,right,10,69,Zone,5-2 Defense,41.0,Cover-3,"FLAT, IN, OUT, IN, GO",C,Short Right Pass,4
2022091100,3526,3,deep,SHOTGUN,3x1,left,3,51,Man,5-2 Defense,59.0,Cover-1,"CORNER, GO, CORNER, IN",C,Shotgun Isolation Deep Attack,4
2022091804,3993,3,short,SHOTGUN,3x1,right,4,103,Other,3-4 Defense,7.0,Red Zone,"OUT, IN, HITCH, POST, GO",C,Short Right Pass,4
2022091804,4386,3,short,SHOTGUN,2x2,left,20,23,Zone,3-4 Defense,87.0,Cover-3,"SLANT, GO, FLAT, OUT, GO",C,Short Left Pass,4
2022092500,3571,3,short,SHOTGUN,2x2,right,14,89,Zone,Heavy LB Defense,79.0,Quarters,"HITCH, HITCH, HITCH",I,Short Right Pass,4
2022100200,3869,3,deep,SHOTGUN,3x1,right,9,68,Zone,5-2 Defense,42.0,Cover-3,"IN, OUT, CORNER, HITCH",I,Third-and-Long Deep Attack,4
2022100906,3724,3,short,SHOTGUN,2x2,left,3,50,Man,5-2 Defense,60.0,Cover-1,"SLANT, SLANT, FLAT, SLANT",C,Short Left Pass,4
2022100906,4267,3,short,SHOTGUN,2x2,right,4,48,Man,4-3 Defense,62.0,Cover-1,"WHEEL, CROSS, CROSS, SLANT, POST",C,Short Right Pass,4
2022101605,3162,3,short,SHOTGUN,3x1,middle,4,86,Zone,5-2 Defense,24.0,Cover-3,"IN, FLAT, HITCH, HITCH, SLANT",C,Short Middle Pass,4
2022101605,3239,3,short,SHOTGUN,3x1,right,12,94,Zone,5-2 Defense,16.0,Quarters,"ANGLE, POST, GO, CROSS, GO",C,Short Right Pass,4
2022101605,3738,3,short,SHOTGUN,2x2,left,4,41,Zone,4-2-5 Nickel,69.0,Cover-3 Seam,"OUT, GO, CROSS, IN, POST",I,Short Left Pass,4
2022101605,3899,3,short,SHOTGUN,2x2,right,3,47,Zone,4-2-5 Nickel,63.0,Cover-6 Right,"OUT, CORNER, POST, OUT, GO",C,Short Right Pass,4
2022102000,3750,3,short,SHOTGUN,3x1,right,9,31,Zone,Big Secondary and LB,21.0,Cover-3 Seam,"HITCH, HITCH, GO, CORNER",C,Short Right Pass,4
2022102000,4227,3,short,SHOTGUN,2x2,left,15,45,Zone,Big Secondary and LB,35.0,Cover-3 Cloud Left,"CORNER, FLAT, HITCH, POST, POST",C,Short Left Pass,4
2022103006,3116,3,short,SHOTGUN,2x2,left,6,88,Man,4-2-5 Nickel,78.0,Cover-1,"CORNER, FLAT, SLANT, OUT, IN",C,Short Left Pass,4
2022103006,3260,3,short,SHOTGUN,2x2,right,5,61,Man,4-2-5 Nickel,51.0,Cover-1,"OUT, SLANT, FLAT, SLANT, SLANT",C,Short Right Pass,4
2022110700,3323,3,short,SHOTGUN,3x1,right,14,23,Zone,Heavy DE Front,87.0,Cover-3,"FLAT, FLAT, OUT, SCREEN, SCREEN",C,Short Right Pass,4
2022091804,4410,4,short,SHOTGUN,2x2,right,10,33,Zone,3-4 Defense,77.0,Quarters,"GO, HITCH, ANGLE, GO, GO",C,Short Right Pass,4
2022102000,3774,4,short,SHOTGUN,2x2,left,3,25,Zone,Big Secondary and LB,15.0,Cover-2,"HITCH, FLAT, SLANT, SLANT",C,Short Left Pass,4
2022103006,3360,4,deep,SINGLEBACK,2x2,left,4,42,Man,4-2-5 Nickel,32.0,Cover-1,"SCREEN, FLAT, CROSS, CROSS, CORNER",I,Spread Misdirection Play,4
2022110700,3347,4,short,SHOTGUN,2x2,left,3,34,Zone,Heavy DE Front,76.0,Cover-3 Seam,"OUT, OUT, FLAT, OUT, OUT",C,Short Left Pass,4
