gameId,playId,down,pass_length,offenseFormation,receiverAlignment,pass_location,yardsToGo,absoluteYardlineNumber,pff_manZone,defenseFormation,yardline_100,pff_passCoverage,routeCombo,passResult,strategy,quarter
2022091103,58,1,short,SHOTGUN,3x1,middle,10,35,Zone,3-4 Defense,75.0,Quarters,"FLAT, CROSS, FLAT, CROSS, GO",C,Short Middle Pass,1
2022091103,719,1,deep,PISTOL,3x1,right,10,76,Zone,3-4 Defense,34.0,Cover-3,"POST, SCREEN, FLAT, GO",C,Pistol Deep Attack,1
2022091806,640,1,short,SHOTGUN,3x1,left,10,74,Zone,3-4 Defense,64.0,Cover-3 Cloud Left,"CROSS, CROSS, FLAT, POST, ANGLE",C,Short Left Pass,1
2022091806,758,1,deep,SINGLEBACK,3x1,middle,10,52,Zone,3-4 Defense,42.0,Cover-2,"POST, CROSS, HITCH, FLAT, CROSS",IN,First Down Play Action Deep Pass,1
2022092200,190,1,short,SINGLEBACK,2x2,right,10,30,Zone,Other,80.0,Cover-3 Seam,"CORNER, FLAT, CROSS, FLAT, CROSS",C,Singleback Balanced Short Pass,1
2022092200,722,1,short,SINGLEBACK,3x1,right,10,35,Zone,Other,75.0,Cover-3,"GO, HITCH, SCREEN",C,Midfield Short Pass,1
2022100210,370,1,deep,EMPTY,3x2,middle,10,87,Zone,3-4 Defense,77.0,Quarters,"SLANT, POST, GO, HITCH, HITCH",IN,Spread Deep Attack from Empty 3x2 Alignment,1
2022100901,320,1,short,SINGLEBACK,2x2,right,10,49,Zone,4-2-5 Nickel,61.0,Cover-3,"CROSS, CROSS, CORNER, GO, SCREEN",C,Midfield Short Pass,1
2022100901,394,1,short,SHOTGUN,2x2,left,10,60,Zone,4-2-5 Nickel,50.0,Quarters,"GO, HITCH, FLAT",C,Short Left Pass,1
2022100901,489,1,short,SHOTGUN,3x1,right,10,85,Man,4-2-5 Nickel,25.0,Cover-1,"CROSS, CORNER, FLAT, HITCH",C,Short Right Pass,1
2022101607,143,1,short,SHOTGUN,2x2,right,10,44,Zone,3-1-7 Quarter,66.0,Cover-3,"GO, HITCH, HITCH, FLAT, HITCH",C,Short Right Pass,1
2022101607,196,1,short,SHOTGUN,3x1,left,10,57,Zone,3-1-7 Quarter,53.0,Cover-2,"GO, HITCH, FLAT, GO",C,Short Left Pass,1
2022101607,402,1,short,SHOTGUN,2x2,right,10,100,Other,3-4 Defense,10.0,Red Zone,"OUT, IN, CORNER, CROSS, ANGLE",C,Short Right Pass,1
2022102311,612,1,short,SINGLEBACK,2x2,right,10,85,Zone,3-4 Defense,75.0,Cover-3,"CROSS, OUT, FLAT, CROSS",C,Singleback Balanced Short Pass,1
2022103008,391,1,short,SINGLEBACK,2x2,right,10,85,Zone,Heavy LB Defense,75.0,Quarters,"CROSS, CROSS, FLAT, CORNER",C,Singleback Balanced Short Pass,1
2022103008,491,1,short,EMPTY,3x2,left,10,71,Zone,5-2 Defense,61.0,Cover-3 Seam,"HITCH, HITCH, OUT, HITCH, IN",C,Short Left Pass,1
2022103008,606,1,short,EMPTY,3x2,right,15,68,Zone,5-2 Defense,58.0,Cover-2,"SCREEN, SCREEN, FLAT, FLAT, FLAT",C,Short Right Pass,1
2022103008,672,1,short,SINGLEBACK,2x2,right,10,52,Zone,Heavy LB Defense,42.0,Cover-2,"CROSS, FLAT, CROSS, ANGLE, CORNER",C,Singleback Balanced Short Pass,1
2022091103,82,2,short,PISTOL,3x1,right,7,38,Zone,3-4 Defense,72.0,Cover-3,"HITCH, OUT, OUT",C,Pistol Quick Pass,1
2022091806,78,2,short,SHOTGUN,3x1,left,8,83,Man,3-4 Defense,73.0,Cover-1,"CROSS, OUT, CORNER",C,Short Left Pass,1
2022091806,706,2,short,SINGLEBACK,3x1,right,4,57,Zone,3-4 Defense,47.0,Cover-3,"GO, CROSS, FLAT, CROSS, GO",C,Short Right Pass,1
2022092200,465,2,short,SHOTGUN,3x1,right,6,76,Zone,Other,34.0,Cover-3 Seam,"HITCH, OUT, FLAT, FLAT, SCREEN",C,Short Right Pass,1
2022092200,746,2,short,SHOTGUN,3x1,left,7,38,Man,Other,72.0,Cover-1,"HITCH, CROSS, CROSS, CORNER, ANGLE",C,Short Left Pass,1
2022092200,791,2,deep,SHOTGUN,3x1,right,3,56,Zone,Other,54.0,Cover 6-Left,"CORNER, HITCH, GO",C,Second-and-Short Deep Shot,1
2022100210,77,2,short,SINGLEBACK,3x1,right,4,79,Zone,3-4 Defense,69.0,Cover-3,"CROSS, ANGLE, HITCH, CORNER",C,Short Right Pass,1
2022100210,122,2,deep,SINGLEBACK,3x1,right,4,68,Zone,3-4 Defense,58.0,Cover-3,"POST, HITCH, POST",I,Play Action Deep Pass,1
2022100210,588,2,short,SHOTGUN,3x1,left,10,85,Zone,5-2 Defense,75.0,Quarters,"HITCH, OUT, POST, ANGLE, HITCH",C,Short Left Pass,1
2022100901,439,2,short,SHOTGUN,2x2,right,4,77,Zone,4-2-5 Nickel,33.0,Quarters,"HITCH, FLAT, CROSS, FLAT, FLAT",I,Short Right Pass,1
2022100901,872,2,short,SHOTGUN,3x1,left,17,28,Zone,4-2-5 Nickel,82.0,Cover-2,"HITCH, OUT, SLANT",C,Short Left Pass,1
2022101607,172,2,short,SHOTGUN,3x1,middle,2,52,Man,3-4 Defense,58.0,Cover-1,"SLANT, SLANT, OUT, FLAT, GO",C,Short Middle Pass,1
2022101607,426,2,short,SHOTGUN,2x2,left,6,104,Man,3-1-7 Quarter,6.0,Cover-1,"SLANT, CROSS, FLAT, HITCH, FLAT",C,Short Left Pass,1
2022101607,839,2,short,SHOTGUN,3x1,right,7,26,Zone,3-4 Defense,84.0,Cover-3,"HITCH, HITCH, GO, HITCH",I,Short Right Pass,1
2022102311,636,2,deep,SHOTGUN,3x1,left,4,79,Man,3-4 Defense,69.0,Cover-1,"HITCH, HITCH, GO, ANGLE, HITCH",IN,Shotgun Isolation Deep Attack,1
2022102311,857,2,short,SHOTGUN,3x1,right,6,81,Zone,3-4 Defense,71.0,Cover-2,"SCREEN, FLAT, FLAT, FLAT, GO",C,Short Right Pass,1
2022103008,467,2,short,SHOTGUN,2x2,left,10,85,Zone,Heavy LB Defense,75.0,Cover-3 Seam,"SCREEN, OUT, CORNER",C,Short Left Pass,1
2022103008,696,2,deep,SHOTGUN,2x2,middle,7,49,Zone,Heavy LB Defense,39.0,Cover-3 Seam,"GO, HITCH, GO, GO",C,Midfield Deep Shotgun Attack,1
2022103008,767,2,short,WILDCAT,3x2,middle,6,16,Other,5-2 Defense,6.0,Red Zone,"CROSS, FLAT, SCREEN",C,Short Middle Pass,1
2022091103,111,3,short,SHOTGUN,3x1,left,2,43,Man,3-4 Defense,67.0,Cover-1,"HITCH, SLANT, ANGLE, HITCH, GO",C,Short Left Pass,1
2022091103,541,3,deep,SHOTGUN,2x2,left,5,40,Man,5-2 Defense,70.0,Cover-1,"GO, CROSS, GO, OUT, IN",I,Midfield Deep Shotgun Attack,1
2022091103,796,3,short,SHOTGUN,2x2,right,2,108,Man,3-4 Defense,2.0,Cover-1,"HITCH, HITCH, OUT, OUT, GO",I,Short Right Pass,1
2022091806,102,3,short,SHOTGUN,3x1,right,4,79,Man,5-2 Defense,69.0,Cover-1,"CROSS, HITCH, FLAT, OUT, GO",I,Short Right Pass,1
2022091806,554,3,short,SHOTGUN,2x2,right,3,78,Man,5-2 Defense,68.0,Cover-1,"SLANT, OUT, OUT, GO, GO",C,Short Right Pass,1
2022092200,489,3,short,EMPTY,3x2,right,8,74,Man,Other,36.0,Cover-1,"IN, GO, FLAT, SCREEN, IN",C,Short Right Pass,1
2022100210,144,3,short,SHOTGUN,3x1,middle,4,68,Zone,3-4 Defense,58.0,Cover-6 Right,"GO, HITCH, OUT, HITCH",C,Short Middle Pass,1
2022100210,612,3,short,EMPTY,3x2,right,5,80,Zone,3-4 Defense,70.0,Quarters,"HITCH, HITCH, HITCH, OUT, CROSS",C,Short Right Pass,1
2022100901,365,3,short,SHOTGUN,3x1,right,11,48,Zone,4-2-5 Nickel,62.0,Cover-6 Right,"IN, GO, OUT, OUT, ANGLE",C,Short Right Pass,1
2022100901,461,3,short,SHOTGUN,2x2,left,4,77,Man,4-2-5 Nickel,33.0,2-Man,"GO, CROSS, CROSS, SLANT, FLAT",C,Short Left Pass,1
2022100901,555,3,short,SHOTGUN,2x2,right,8,99,Other,4-2-5 Nickel,11.0,Bracket,"OUT, CROSS, CROSS, POST, FLAT",I,Short Right Pass,1
2022100901,896,3,short,SHOTGUN,3x1,middle,6,39,Zone,4-2-5 Nickel,71.0,Cover-2,"HITCH, POST, OUT, GO, FLAT",I,Short Middle Pass,1
2022102311,376,3,deep,SHOTGUN,3x1,left,3,78,Man,3-4 Defense,68.0,Cover-1,"GO, CROSS, OUT, IN, GO",I,Shotgun Isolation Deep Attack,1
2022102311,881,3,short,SINGLEBACK,3x1,right,2,77,Zone,3-4 Defense,67.0,Cover-3,"CROSS, GO, SCREEN, FLAT, CROSS",C,Short Yardage Pass,1
2022103008,797,3,short,SHOTGUN,2x2,left,2,12,Man,5-2 Defense,2.0,Cover-1,"GO, FLAT, SLANT",I,Short Left Pass,1
2022103008,848,4,short,JUMBO,2x2,left,1,11,Other,5-2 Defense,1.0,Red Zone,"FLAT, CROSS, ANGLE",C,Short Left Pass,1
2022091103,1126,1,short,SINGLEBACK,2x2,right,10,51,Zone,3-4 Defense,41.0,Cover-3 Seam,"GO, FLAT, GO, CROSS",C,Singleback Balanced Short Pass,2
2022091103,1471,1,short,SHOTGUN,3x1,left,10,102,Zone,3-4 Defense,92.0,Cover-2,"SLANT, OUT, HITCH, GO, FLAT",I,Short Left Pass,2
2022091806,1189,1,short,EMPTY,3x2,left,15,86,Zone,5-2 Defense,24.0,Quarters,"OUT, HITCH, GO, CROSS, GO",I,Short Left Pass,2
2022091806,1442,1,short,SHOTGUN,2x2,middle,10,30,Zone,3-4 Defense,80.0,Cover-3,"HITCH, SLANT, FLAT, SCREEN, GO",C,Short Middle Pass,2
2022091806,1873,1,deep,SHOTGUN,3x1,right,10,35,Zone,5-2 Defense,75.0,Cover-2,"GO, GO, GO, GO, OUT",C,Midfield Deep Shotgun Attack,2
2022091806,1897,1,deep,SHOTGUN,3x1,right,10,58,Man,5-2 Defense,52.0,Cover-1 Double,"GO, GO, CROSS, GO, OUT",I,Shotgun Isolation Deep Attack,2
2022092200,1314,1,short,SHOTGUN,3x1,right,10,85,Zone,Other,75.0,Cover-3,"HITCH, CORNER, SCREEN, SLANT",C,Short Right Pass,2
2022092200,1369,1,deep,SINGLEBACK,2x2,right,10,74,Zone,Other,64.0,Cover-3,"OUT, SCREEN, IN, FLAT, CROSS",C,First Down Play Action Deep Pass,2
2022092200,1938,1,deep,EMPTY,3x2,left,10,73,Zone,Other,63.0,Cover-2,"CORNER, CROSS, FLAT, FLAT, GO",C,Spread Deep Attack from Empty 3x2 Alignment,2
2022092200,1962,1,deep,SHOTGUN,2x2,right,10,53,Zone,Other,43.0,Cover-2,"GO, CORNER, HITCH, GO",I,Flood Concept (Intermediate Stretch),2
2022100210,1329,1,deep,SINGLEBACK,3x1,right,10,25,Zone,5-2 Defense,85.0,Cover-3,"GO, IN, CROSS",C,First Down Play Action Deep Pass,2
2022100210,1977,1,short,SHOTGUN,3x1,middle,10,40,Zone,3-4 Defense,70.0,Quarters,"GO, CROSS, ANGLE, HITCH, HITCH",C,Short Middle Pass,2
2022100210,2001,1,short,SHOTGUN,3x1,middle,10,54,Man,5-2 Defense,56.0,2-Man,"GO, POST, FLAT, CROSS, HITCH",I,Short Middle Pass,2
2022100901,1536,1,short,SHOTGUN,3x1,right,10,85,Zone,4-2-5 Nickel,75.0,Cover-6 Right,"OUT, HITCH, HITCH, FLAT, OUT",C,Short Right Pass,2
2022100901,1584,1,short,SHOTGUN,2x2,left,10,64,Man,4-2-5 Nickel,54.0,Cover-1,"GO, POST, SLANT, FLAT, GO",I,Short Left Pass,2
2022100901,2020,1,short,SHOTGUN,3x1,right,10,83,Zone,4-2-5 Nickel,73.0,Cover-2,"HITCH, IN, FLAT, FLAT, GO",C,Short Right Pass,2
2022100901,2083,1,deep,SHOTGUN,3x1,left,10,73,Zone,4-2-5 Nickel,63.0,Cover-2,"GO, IN, FLAT, SCREEN, GO",IN,Shotgun Isolation Deep Attack,2
2022101607,1453,1,short,SHOTGUN,2x2,left,20,56,Zone,3-4 Defense,46.0,Cover-3,"IN, SCREEN, IN, SCREEN, OUT",I,Short Left Pass,2
2022101607,1896,1,short,SHOTGUN,2x2,left,10,96,Zone,3-4 Defense,86.0,Cover-3,"CORNER, CROSS, GO, OUT, IN",I,Short Left Pass,2
2022102311,1018,1,short,SINGLEBACK,3x1,right,10,64,Zone,3-4 Defense,46.0,Cover-3,"GO, IN, OUT, CROSS",C,Short Right Pass,2
2022102311,1313,1,short,SINGLEBACK,3x1,left,10,24,Zone,3-4 Defense,86.0,Cover-3,"GO, CROSS, CROSS, GO",C,Short Left Pass,2
2022102311,1366,1,short,SHOTGUN,3x1,middle,10,50,Zone,3-4 Defense,60.0,Cover-3,"HITCH, IN, ANGLE, HITCH, GO",C,Short Middle Pass,2
2022102311,1445,1,short,SHOTGUN,2x2,right,10,64,Zone,3-4 Defense,46.0,Cover-3,"OUT, SLANT, CORNER, SLANT, FLAT",C,Short Right Pass,2
2022102311,1535,1,short,SHOTGUN,3x1,right,20,64,Zone,3-4 Defense,46.0,Cover-2,"CROSS, HITCH, CROSS, ANGLE, GO",C,Short Right Pass,2
2022103008,1326,1,short,SHOTGUN,3x1,right,15,22,Zone,Heavy LB Defense,88.0,Cover-3,"SCREEN, FLAT, SCREEN, GO",C,Short Right Pass,2
2022103008,1529,1,short,I_FORM,2x1,right,10,32,Zone,Heavy LB Defense,78.0,Cover-3,"FLAT, HITCH, CROSS, FLAT, CROSS",I,Short Right Pass,2
2022103008,1885,1,short,SHOTGUN,3x1,right,10,57,Zone,Heavy LB Defense,53.0,Cover-2,"GO, GO, FLAT, HITCH, GO",C,Short Right Pass,2
2022103008,2242,1,short,SHOTGUN,3x1,right,10,32,Zone,Heavy LB Defense,78.0,Cover 6-Left,"GO, POST, FLAT, HITCH, GO",C,Short Right Pass,2
2022091103,1171,2,short,SHOTGUN,3x1,right,7,17,Man,3-4 Defense,7.0,Cover-1,"GO, IN, FLAT, HITCH, GO",C,Short Right Pass,2
2022091103,1249,2,short,JUMBO,1x0,left,1,11,Other,3-4 Defense,1.0,Goal Line,"FLAT, HITCH, FLAT",C,Short Left Pass,2
2022091806,971,2,short,SHOTGUN,3x1,right,10,58,Man,5-2 Defense,52.0,Cover-1,"HITCH, HITCH, HITCH, GO",I,Short Right Pass,2
2022091806,1052,2,short,SHOTGUN,3x1,middle,17,63,Man,3-4 Defense,47.0,Cover-1,"GO, IN, HITCH, GO",I,Short Middle Pass,2
2022091806,1211,2,short,SHOTGUN,2x2,right,15,86,Zone,Heavy LB Defense,24.0,Cover-3,"GO, SLANT, FLAT, IN, GO",C,Short Right Pass,2
2022091806,1559,2,short,SHOTGUN,3x1,right,13,39,Man,5-2 Defense,71.0,Cover-1,"CROSS, OUT, FLAT, CORNER",C,Short Right Pass,2
2022092200,1991,2,deep,SHOTGUN,2x2,left,10,53,Man,Other,43.0,2-Man,"CORNER, HITCH, OUT, SCREEN, CORNER",I,General Screen Play,2
2022100210,994,2,deep,SHOTGUN,3x1,middle,16,29,Zone,3-4 Defense,81.0,Quarters,"GO, HITCH, OUT, IN, FLAT",C,Scoring Zone Deep Pass,2
2022100210,1102,2,deep,SHOTGUN,2x2,middle,8,87,Zone,5-2 Defense,23.0,Quarters,"POST, IN, GO, OUT, CROSS",I,Deep Middle Pass,2
2022100210,1647,2,deep,SHOTGUN,2x2,right,13,41,Man,3-4 Defense,69.0,Cover-1,"GO, CROSS, OUT, IN, GO",I,Midfield Deep Shotgun Attack,2
2022100901,1606,2,short,SHOTGUN,3x1,right,10,64,Zone,4-2-5 Nickel,54.0,Quarters,"HITCH, CROSS, OUT, FLAT",C,Short Right Pass,2
2022100901,1675,2,deep,SHOTGUN,2x2,right,9,29,Man,4-2-5 Nickel,19.0,Cover-1,"GO, GO, HITCH, CORNER, ANGLE",I,Scoring Zone Deep Pass,2
2022101607,1368,2,short,SHOTGUN,2x2,left,7,56,Zone,3-1-7 Quarter,46.0,Cover-2,"FLAT, SLANT, HITCH, FLAT, SLANT",C,Short Left Pass,2
2022101607,1475,2,short,SHOTGUN,2x2,right,20,56,Zone,3-4 Defense,46.0,Cover 6-Left,"IN, IN, HITCH, FLAT, CORNER",C,Short Right Pass,2
2022101607,1677,2,short,SHOTGUN,3x1,left,8,82,Zone,3-4 Defense,72.0,Quarters,"GO, GO, GO",I,Short Left Pass,2
2022102311,1063,2,short,SINGLEBACK,2x2,left,7,79,Zone,3-4 Defense,31.0,Cover-3,"CROSS, CROSS, FLAT, CORNER",C,Singleback Balanced Short Pass,2
2022102311,1337,2,deep,SHOTGUN,3x1,left,14,20,Zone,3-4 Defense,90.0,Cover-2,"GO, POST, ANGLE, HITCH, GO",C,Red Zone Deep Shotgun Attack,2
2022102311,1469,2,short,SHOTGUN,2x2,right,4,70,Zone,5-2 Defense,40.0,Cover-3,"HITCH, HITCH, HITCH, OUT",C,Short Right Pass,2
2022102311,1653,2,short,SHOTGUN,3x1,right,7,103,Man,3-4 Defense,7.0,Cover-1,"CROSS, CROSS, FLAT, SLANT, GO",C,Short Right Pass,2
2022103008,1551,2,deep,SHOTGUN,3x1,right,10,32,Man,Heavy LB Defense,78.0,Cover-1,"SCREEN, GO, SCREEN, GO",I,Midfield Deep Shotgun Attack,2
2022103008,1809,2,deep,SHOTGUN,3x1,left,10,45,Zone,Heavy LB Defense,65.0,Cover-3,"GO, GO, FLAT, POST, GO",I,Midfield Deep Shotgun Attack,2
2022103008,1912,2,short,EMPTY,3x2,right,3,64,Zone,Heavy LB Defense,46.0,Cover-3,"SLANT, OUT, GO, HITCH, IN",C,Short Right Pass,2
2022103008,1962,2,short,SHOTGUN,3x1,left,10,71,Zone,Heavy LB Defense,39.0,Cover 6-Left,"CROSS, GO, HITCH, OUT, FLAT",C,Short Left Pass,2
2022103008,2019,2,deep,SHOTGUN,3x1,left,7,92,Zone,5-2 Defense,18.0,Cover-3,"GO, OUT, FLAT, IN, GO",I,Shotgun Isolation Deep Attack,2
2022091806,1004,3,short,SHOTGUN,2x2,left,10,58,Zone,Interior DL Heavy,52.0,Cover-3,"GO, SLANT, IN, GO, ANGLE",C,Short Left Pass,2
2022091806,1074,3,deep,SHOTGUN,3x1,left,17,63,Zone,5-2 Defense,47.0,Cover-3,"OUT, GO, OUT, IN, FLAT",C,Third-and-Long Deep Attack,2
2022091806,1491,3,short,SHOTGUN,2x2,left,3,37,Man,5-2 Defense,73.0,Cover-1,"HITCH, OUT, IN, GO",C,Short Left Pass,2
2022091806,1593,3,short,EMPTY,3x2,middle,7,45,Man,5-2 Defense,65.0,Cover-1,"GO, POST, CROSS, GO, OUT",I,Short Middle Pass,2
2022091806,1943,3,deep,SHOTGUN,3x1,right,14,54,Other,5-2 Defense,56.0,Prevent,"HITCH, GO, GO, GO, FLAT",I,Third-and-Long Deep Attack,2
2022092200,2013,3,short,EMPTY,3x2,right,10,53,Other,Other,43.0,Prevent,"IN, FLAT, OUT",I,Short Right Pass,2
2022100210,1431,3,deep,SHOTGUN,3x1,right,18,41,Zone,3-4 Defense,69.0,Quarters,"HITCH, OUT, HITCH, POST, OUT",I,Third-and-Long Deep Attack,2
2022100901,1252,3,short,EMPTY,3x2,left,4,84,Zone,Secondary Emphasis with DT,74.0,Cover-3,"IN, HITCH, OUT, FLAT, GO",C,Short Left Pass,2
2022100901,1397,3,short,SHOTGUN,3x1,middle,8,83,Man,4-2-5 Nickel,73.0,2-Man,"POST, POST, IN, GO, FLAT",I,Short Middle Pass,2
2022100901,1630,3,deep,SHOTGUN,2x2,left,5,59,Zone,4-2-5 Nickel,49.0,Cover-3,"HITCH, POST, GO",C,General Strategy,2
2022100901,1697,3,short,SHOTGUN,3x1,right,9,29,Zone,4-2-5 Nickel,19.0,Cover-2,"CORNER, POST, FLAT, POST, FLAT",C,Short Right Pass,2
2022101607,1320,3,short,SHOTGUN,2x2,left,4,65,Man,3-4 Defense,55.0,Cover-1,"OUT, HITCH, GO, CORNER, FLAT",C,Short Left Pass,2
2022101607,1392,3,short,SHOTGUN,2x2,left,6,55,Zone,3-4 Defense,45.0,Cover-3,"OUT, GO, HITCH, HITCH",C,Short Left Pass,2
2022101607,1499,3,short,SHOTGUN,3x1,left,15,51,Zone,Heavy DE Front,41.0,Cover-2,"SLANT, FLAT, HITCH, HITCH, FLAT",C,Short Left Pass,2
2022101607,1699,3,short,SHOTGUN,3x1,right,8,82,Zone,3-4 Defense,72.0,Cover 6-Left,"POST, CROSS, HITCH, GO, FLAT",I,Short Right Pass,2
2022102311,1092,3,short,SHOTGUN,2x2,left,3,83,Man,3-4 Defense,27.0,Cover-1,"FLAT, SLANT, OUT, CORNER",I,Short Left Pass,2
2022102311,1421,3,short,SHOTGUN,3x1,left,2,58,Man,3-4 Defense,52.0,Cover-1,"HITCH, GO, OUT, HITCH",C,Short Left Pass,2
2022103008,1371,3,short,SHOTGUN,3x1,left,19,18,Zone,5-2 Defense,92.0,Quarters,"GO, GO, GO, GO, SCREEN",C,Short Left Pass,2
2022103008,1573,3,short,SHOTGUN,3x1,middle,10,32,Zone,Heavy LB Defense,78.0,Cover-6 Right,"CROSS, HITCH, HITCH, GO, FLAT",I,Short Middle Pass,2
2022091103,2008,1,short,SINGLEBACK,2x2,right,10,19,Zone,3-4 Defense,91.0,Cover-3,"SLANT, CORNER, CROSS, CROSS",I,Red Zone Short Pass,3
2022091103,2483,1,short,SHOTGUN,3x1,middle,10,46,Zone,3-4 Defense,64.0,Cover 6-Left,"HITCH, FLAT, FLAT, GO",C,Short Middle Pass,3
2022091806,2299,1,short,SINGLEBACK,2x2,right,10,68,Zone,3-4 Defense,58.0,Cover-2,"POST, CROSS, OUT, CROSS",C,Singleback Balanced Short Pass,3
2022091806,2368,1,short,SHOTGUN,3x1,right,10,45,Zone,3-4 Defense,35.0,Cover-3,"CROSS, OUT, OUT",I,Short Right Pass,3
2022091806,2743,1,short,SINGLEBACK,2x2,middle,10,85,Zone,3-4 Defense,75.0,Cover-2,"GO, POST, ANGLE, HITCH",C,Singleback Balanced Short Pass,3
2022091806,2767,1,short,EMPTY,3x2,left,10,71,Man,3-4 Defense,61.0,Cover-1,"SLANT, HITCH, OUT, FLAT, GO",I,Short Left Pass,3
2022091806,2855,1,short,SHOTGUN,3x1,left,10,37,Zone,3-4 Defense,27.0,Quarters,"OUT, HITCH, POST, OUT",C,Short Left Pass,3
2022092200,2083,1,short,PISTOL,2x2,right,10,26,Zone,Other,84.0,Cover-3,"FLAT, GO, ANGLE, SLANT",C,Pistol Quick Pass,3
2022092200,2331,1,short,SHOTGUN,3x1,right,10,64,Zone,Other,46.0,Quarters,"GO, CROSS, FLAT, HITCH",C,Short Right Pass,3
2022100210,2385,1,deep,SHOTGUN,3x1,left,10,59,Zone,5-2 Defense,49.0,Quarters,"CROSS, POST, HITCH, FLAT",IN,Spread Misdirection Play,3
2022100210,2531,1,short,PISTOL,2x2,middle,4,14,Man,3-4 Defense,4.0,Cover-0,"SLANT, SCREEN, GO, FLAT, GO",C,Pistol Quick Pass,3
2022100210,2900,1,short,SHOTGUN,2x2,left,10,92,Zone,5-2 Defense,82.0,Quarters,"GO, CROSS, CROSS, FLAT, OUT",C,Short Left Pass,3
2022100210,2951,1,short,SHOTGUN,2x2,right,10,62,Zone,5-2 Defense,52.0,Quarters,"HITCH, HITCH, HITCH, FLAT, OUT",C,Short Right Pass,3
2022100901,2213,1,deep,I_FORM,2x1,right,10,35,Zone,4-2-5 Nickel,75.0,Quarters,"OUT, CROSS, IN, OUT",C,First Down Play Action Deep Pass,3
2022100901,2354,1,short,SHOTGUN,3x1,left,10,86,Zone,4-2-5 Nickel,24.0,Cover-3,"OUT, SLANT, SLANT",C,Short Left Pass,3
2022100901,2768,1,short,SHOTGUN,2x2,left,10,30,Zone,Secondary Emphasis with DT,80.0,Cover-3,"HITCH, SCREEN, CROSS, HITCH, ANGLE",C,Short Left Pass,3
2022100901,2797,1,short,SHOTGUN,2x2,left,10,40,Zone,Secondary Emphasis with DT,70.0,Quarters,"OUT, FLAT, SLANT, HITCH, WHEEL",C,Short Left Pass,3
2022100901,2895,1,short,SHOTGUN,2x2,right,10,72,Zone,4-2-5 Nickel,38.0,Quarters,"OUT, GO, HITCH, GO, ANGLE",C,Short Right Pass,3
2022101607,2138,1,short,EMPTY,3x2,left,10,98,Zone,3-1-7 Quarter,12.0,Cover-3,"OUT, CORNER, GO, GO, HITCH",C,Short Left Pass,3
2022101607,2739,1,short,SHOTGUN,2x2,middle,20,25,Zone,3-1-7 Quarter,85.0,Cover-2,"HITCH, POST, GO, ANGLE, GO",I,Short Middle Pass,3
2022102311,2330,1,short,SHOTGUN,3x1,right,10,95,Zone,3-4 Defense,85.0,Cover-3,"HITCH, FLAT, CROSS, CORNER",I,Short Right Pass,3
2022102311,2388,1,short,SHOTGUN,2x2,middle,10,83,Zone,3-4 Defense,73.0,Cover-3,"HITCH, CORNER, SLANT, FLAT, SLANT",C,Short Middle Pass,3
2022103008,2490,1,short,SINGLEBACK,3x1,right,10,35,Zone,Heavy LB Defense,75.0,Cover-3,"CROSS, GO, FLAT, CROSS",C,Midfield Short Pass,3
2022103008,2620,1,short,SHOTGUN,3x1,middle,20,37,Man,Heavy LB Defense,73.0,Cover-1,"HITCH, HITCH, OUT, HITCH, HITCH",C,Short Middle Pass,3
2022103008,2644,1,short,EMPTY,3x2,left,10,62,Zone,Heavy LB Defense,48.0,Cover-3 Seam,"HITCH, OUT, GO, POST, HITCH",C,Short Left Pass,3
2022103008,2742,1,short,EMPTY,3x2,left,10,78,Zone,Heavy LB Defense,32.0,Cover-3 Seam,"GO, SLANT, HITCH, GO, IN",C,Short Left Pass,3
2022103008,3236,1,short,SHOTGUN,3x1,right,10,52,Zone,Heavy LB Defense,58.0,Cover-6 Right,"HITCH, HITCH, FLAT, HITCH, HITCH",I,Short Right Pass,3
2022091103,2103,2,short,SHOTGUN,3x1,left,14,26,Zone,3-4 Defense,84.0,Cover 6-Left,"GO, CROSS, HITCH, OUT",I,Short Left Pass,3
2022091103,2433,2,short,SHOTGUN,2x2,left,12,33,Zone,3-4 Defense,77.0,Cover-3,"HITCH, GO, POST, GO",C,Short Left Pass,3
2022091806,2390,2,short,SINGLEBACK,3x1,left,10,45,Zone,3-4 Defense,35.0,Quarters,"SCREEN, GO, FLAT",C,Midfield Short Pass,3
2022091806,2831,2,short,SHOTGUN,3x1,left,2,45,Zone,3-4 Defense,35.0,Cover-3,"POST, POST, OUT, HITCH, IN",C,Short Left Pass,3
2022092200,2112,2,short,SHOTGUN,3x1,left,9,27,Man,Other,83.0,Cover-1,"SLANT, CORNER, FLAT, HITCH",I,Short Left Pass,3
2022092200,2274,2,short,SHOTGUN,2x2,left,7,55,Zone,Other,55.0,Cover-6 Right,"SLANT, CROSS, FLAT, CORNER, CROSS",C,Short Left Pass,3
2022092200,2428,2,short,SHOTGUN,2x2,right,19,55,Zone,Other,55.0,Quarters,"GO, CROSS, FLAT, HITCH, FLAT",C,Short Right Pass,3
2022100210,3043,2,short,EMPTY,3x2,left,9,50,Zone,5-2 Defense,40.0,Quarters,"SLANT, HITCH, HITCH, OUT, OUT",C,Short Left Pass,3
2022100901,2330,2,short,SHOTGUN,2x2,left,1,77,Zone,4-2-5 Nickel,33.0,Quarters,"OUT, HITCH, SCREEN, SLANT",C,Short Left Pass,3
2022101607,2167,2,short,SHOTGUN,2x1,right,5,103,Zone,3-4 Defense,7.0,Cover-3,"SLANT, OUT, FLAT, FLAT, FLAT",I,Short Right Pass,3
2022101607,2773,2,short,SHOTGUN,2x2,left,20,25,Zone,3-1-7 Quarter,85.0,Quarters,"HITCH, GO, POST, FLAT, SLANT",C,Short Left Pass,3
2022101607,2842,2,short,EMPTY,3x2,left,9,47,Zone,5-2 Defense,63.0,Cover 6-Left,"HITCH, IN, FLAT, CORNER, OUT",C,Short Left Pass,3
2022101607,3055,2,short,SHOTGUN,2x2,middle,16,52,Zone,3-1-7 Quarter,58.0,Cover-2,"SLANT, GO, SLANT, FLAT, CORNER",C,Short Middle Pass,3
2022102311,2364,2,short,SHOTGUN,3x1,left,10,95,Zone,3-4 Defense,85.0,Cover-3,"HITCH, HITCH, HITCH, SCREEN, HITCH",C,Short Left Pass,3
2022102311,2415,2,short,SHOTGUN,2x2,left,4,77,Zone,3-4 Defense,67.0,Cover-2,"HITCH, OUT, FLAT, HITCH, HITCH",C,Short Left Pass,3
2022102311,2675,2,short,SHOTGUN,2x2,middle,23,84,Zone,3-4 Defense,74.0,Cover-3,"HITCH, GO, HITCH, GO, ANGLE",C,Short Middle Pass,3
2022103008,2514,2,short,EMPTY,3x2,left,2,43,Zone,Heavy LB Defense,67.0,Cover-3 Seam,"HITCH, GO, GO, HITCH, OUT",I,Short Left Pass,3
2022103008,2809,2,short,SHOTGUN,2x2,right,10,93,Man,Heavy LB Defense,17.0,Cover-1,"OUT, CROSS, IN, CORNER",C,Short Right Pass,3
2022103008,3158,2,short,EMPTY,3x2,left,7,14,Man,Heavy LB Defense,96.0,Cover-1,"OUT, OUT, OUT, HITCH, GO",C,Red Zone Quick Pass,3
2022103008,3258,2,short,SHOTGUN,2x2,left,10,52,Zone,Heavy LB Defense,58.0,Cover-3,"GO, POST, OUT, HITCH",C,Short Left Pass,3
2022091103,2058,3,short,SHOTGUN,3x1,middle,2,27,Zone,3-4 Defense,83.0,Cover-3 Seam,"HITCH, HITCH, ANGLE, HITCH, GO",C,Short Middle Pass,3
2022091103,2125,3,deep,SHOTGUN,2x2,right,14,26,Man,5-2 Defense,84.0,Cover-0,"IN, SCREEN, OUT, GO",I,Third-and-Long Deep Attack,3
2022091103,2569,3,short,SHOTGUN,2x2,middle,16,40,Zone,5-2 Defense,70.0,Cover-3,"OUT, POST, HITCH, HITCH, GO",C,Short Middle Pass,3
2022091806,2414,3,short,SHOTGUN,3x1,left,8,43,Man,5-2 Defense,33.0,Cover-1,"CROSS, CROSS, FLAT, POST, FLAT",C,Short Left Pass,3
2022092200,2134,3,short,SHOTGUN,3x1,right,9,27,Zone,Other,83.0,Cover-3,"CORNER, CROSS, FLAT, CORNER",C,Short Right Pass,3
2022092200,2457,3,short,EMPTY,3x2,left,5,69,Man,Other,41.0,2-Man,"CROSS, OUT, CORNER",I,Short Left Pass,3
2022092200,2966,3,deep,EMPTY,3x2,left,3,42,Man,Other,68.0,Cover-1,"GO, SLANT, OUT, GO",I,Spread Deep Attack from Empty 3x2 Alignment,3
2022100210,3072,3,short,SHOTGUN,3x1,left,4,45,Man,3-4 Defense,35.0,Cover-1,"GO, IN, CROSS, GO",C,Short Left Pass,3
2022100901,2407,3,short,SHOTGUN,3x1,right,6,90,Zone,4-2-5 Nickel,20.0,Cover-2,"HITCH, CROSS, GO, OUT",I,Short Right Pass,3
2022100901,3001,3,short,SHOTGUN,3x1,left,15,81,Zone,4-2-5 Nickel,29.0,Cover-2,"CORNER, FLAT, HITCH, HITCH",C,Short Left Pass,3
2022101607,2189,3,short,SHOTGUN,2x2,right,5,103,Other,3-4 Defense,7.0,Bracket,"OUT, POST, IN, CORNER",I,Short Right Pass,3
2022101607,2797,3,short,SHOTGUN,3x1,middle,15,30,Zone,Heavy DE Front,80.0,Cover-3,"GO, HITCH, CORNER, HITCH",C,Short Middle Pass,3
2022101607,2866,3,short,SHOTGUN,2x2,right,5,51,Man,Heavy DE Front,59.0,Cover-1,"OUT, CROSS, GO, IN",I,Short Right Pass,3
2022101607,3079,3,short,SHOTGUN,2x2,left,5,63,Zone,3-1-7 Quarter,47.0,Cover-2,"IN, GO, OUT, OUT",I,Short Left Pass,3
2022102311,2088,3,short,SHOTGUN,3x1,left,22,95,Zone,Heavy DE Front,85.0,Cover-3,"GO, POST, POST, GO, SCREEN",C,Short Left Pass,3
2022102311,2439,3,short,SHOTGUN,2x2,middle,3,76,Man,3-4 Defense,66.0,Cover-1,"GO, IN, OUT, IN, GO",C,Short Middle Pass,3
2022103008,2536,3,deep,SINGLEBACK,3x1,left,2,43,Zone,Heavy LB Defense,67.0,Cover-3,"GO, CROSS, POST",I,Short Yardage Pass,3
2022103008,2689,3,short,SHOTGUN,3x1,left,3,69,Zone,Heavy LB Defense,41.0,Cover-3 Seam,"GO, GO, FLAT, POST, CROSS",C,Short Left Pass,3
2022103008,2838,3,short,SHOTGUN,3x1,left,4,99,Man,Heavy LB Defense,11.0,Cover-1,"CROSS, GO, SLANT, GO, FLAT",I,Short Left Pass,3
2022100901,2429,4,short,SHOTGUN,2x2,left,6,90,Man,4-2-5 Nickel,20.0,2-Man,"OUT, IN, HITCH, GO",I,Short Left Pass,3
2022103008,2713,4,short,SHOTGUN,2x2,left,3,69,Zone,Heavy LB Defense,41.0,Cover-3,"OUT, CROSS, FLAT, SLANT, POST",C,Short Left Pass,3
2022091103,2807,1,short,SHOTGUN,3x1,left,10,40,Zone,3-4 Defense,30.0,Cover-2,"SLANT, OUT, SCREEN, OUT, GO",I,Short Left Pass,4
2022092200,3569,1,short,SHOTGUN,3x1,right,10,104,Zone,Other,94.0,Quarters,"SLANT, OUT, SCREEN, FLAT, CORNER",C,Short Right Pass,4
2022092200,3759,1,short,SHOTGUN,3x1,left,10,90,Zone,Other,80.0,Cover-3,"GO, GO, POST, HITCH",C,Short Left Pass,4
2022092200,3788,1,deep,SHOTGUN,3x1,middle,10,77,Zone,Other,67.0,Cover-6 Right,"GO, HITCH, GO, GO",C,Shotgun Isolation Deep Attack,4
2022092200,3812,1,short,SHOTGUN,2x2,middle,10,51,Zone,Other,41.0,Quarters,"GO, POST, POST, HITCH",C,Short Middle Pass,4
2022092200,3836,1,deep,SHOTGUN,2x2,right,10,36,Zone,Other,26.0,Quarters,"CORNER, GO, POST, GO",I,Midfield Deep Shotgun Attack,4
2022092200,4183,1,short,SHOTGUN,3x1,left,10,106,Other,Other,96.0,Prevent,"HITCH, CROSS, GO, GO",C,Short Left Pass,4
